title,link,description,bloggername,bloggerlink,postdate
외국환업무취급기관과 외국환은행의 국제금융 역할과 중요성,https://blog.naver.com/jmyzcktdp/224039607082,디지털 금융과 핀테크가 발달하면서 외환 거래가 훨씬 더 쉽고 빠르게 이루어지고 있지만 이와 동시에 앞으로도 디지털 금융과 핀테크 기술이 발전하면서 이들의 역할은 더욱 커질 것으로 기대됩니다 ,비즈니스 팁,blog.naver.com/jmyzcktdp,20251013
미국에서 제2의 신용카드 대란 사태 BNPL 발생 예상,https://blog.naver.com/spartacus9/224039602311,은행은 리스크를 모르고 소비자는 안심하고 그 사이에서 핀테크 기업들은 성장률 200 를 자랑한다 이 얼마나 낯익은 광경인가 2002년의 신용카드 대란도 터지기 전까지는 문제 없다 는 말로 ,999 SOAVD,blog.naver.com/spartacus9,20251013
투나아트 사기 투자 무언가 이상하게 잘 풀릴 땐 의심 사칭 ,https://blog.naver.com/slted81266/224039600947, 사칭 팀미션사기 주식사기 코인사기 스캠사기 사칭사기 공모주사기 투자사기 투자사기대응법 투자사기법적대응 사기피해회복 사기피해대응 사기피해전문변호사 핀테크전문 사기피해전문 ,daylaw 강민성 대표 변호사,blog.naver.com/slted81266,20251013
비코노미 사기 biconamy 사칭 코인투자 주의하세요,https://blog.naver.com/mgreatmaild18/224039452026,주의하세요 팀미션사기 주식사기 코인사기 스캠사기 사칭사기 공모주사기 투자사기 투자사기대응법 투자사기법적대응 사기피해회복 사기피해대응 사기피해전문변호사 핀테크전문 사기피해전문 ,daylaw,blog.naver.com/mgreatmaild18,20251013
 위더피플 News clipping 10월 13일자 블록체인 관련 ,https://blog.naver.com/wethepeople_law/224039586148,가상자산 M amp A 3배 급증 금융 핀테크 합종연횡 본격화 2025년 3분기 글로벌 가상자산 M amp A 발표 건수가 작년 동기 대비 3배 증가 금융기업들이 디지털 자산 기업과 협업 확대 결제 인프라 경쟁 가속화 ,위더피플 법률사무소 공식블로그,blog.naver.com/wethepeople_law,20251013
모인 해외송금 말레이시아 송금까지 더 빠르고 저렴하게 ,https://blog.naver.com/totogi777/224039582600,모인 해외송금 시중은행보다 빠르고 저렴한 서비스입니다 모인 해외송금은 전 세계 60개국으로 송금이 가능한 전문 핀테크 서비스입니다 기존 은행이 사용하는 SWIFT망을 거치지 않고 자체 네트워크를 통해 ,건빵이 블로그,blog.naver.com/totogi777,20251013
 이뮤니스바이오 엑시스모빌리티 티지엠핀테크주식 ,https://blog.naver.com/eerr99555/224039581144,티지엠핀테크 시세및 거래문의 장외주식 비상장주식 매도 매수 호가정보 장외주식 ipo 이뮤니스바이오주식 엑시스모빌리티주식 티지엠핀테크주식 이뮤니스바이오 이뮤니스바이오주식 ,"장외주식 정보,시세",blog.naver.com/eerr99555,20251013
 번화 소식 이만희 차장검사 고문 변호사 영입,https://blog.naver.com/bh-law/224039579742,저희 번화는 금융 핀테크 가상자산 및 금융범죄 분야에서 차별화된 법률 서비스를 제공하며 빠르게 수행하며 핀테크 산업과 함께 성장해왔습니다 이번 영입은 형사와 금융법이 결합된 고도화된 리걸 서비스 ,번화의 법률 이야기,blog.naver.com/bh-law,20251013
네이버와 두나무의 합병 네이버가 꿈꾸는 것 feat Buy 볼트온 ,https://blog.naver.com/junsoo25/224039577954,집토끼를 다 잡자 이후 안정적으로 집토끼에게 물건을 팔 수 있는 쇼핑 amp 핀테크 등으로 진출한다 더 이상 잡을 집토끼가 부족하고 집토끼에게 팔 수 있는 새로운 것이 부족해지자 산토끼를 잡기 위해 ,통찰과객관,blog.naver.com/junsoo25,20251013
글로벌 결제 시장의 변화와 스테이블코인의 부상,https://blog.naver.com/biz001/224039565553,국내 주요 암호화폐 거래소들은 스테이블코인 거래 서비스를 제공하고 있으며 일부 핀테크 기업들은 블록체인 기반 송금 서비스를 개발하고 있다 또한 카카오 네이버 같은 대형 IT 기업들도 블록체인 ,기업사랑컨설팅.창업멘토,blog.naver.com/biz001,20251013
김경란 전남편 김상민 국회의원 기업가 변신부터 재혼까지,https://blog.naver.com/okimina80/224039562021,청년 국회의원으로서 대통령 직속 청년위원회 위원장을 맡으며 세대를 대변하는 정치인으로 이름을 알렸고 또한 정무위원회 소속으로 핀테크와 블록체인 등 혁신 산업에 대한 입법을 주도하며 오픈뱅킹과 ,Lesha's one moment in time!,blog.naver.com/okimina80,20251013
10 13 월요일 주요 테마 정리,https://blog.naver.com/1vs9/224039555191,핀테크 전자결제 디지털금융 구분 주요 종목 대장주 카카오페이 NHN KCP 쿠콘 플랫폼 헥토파이낸셜 한국정보인증 핀텔 확산주 갤럭시아머니트리 KG이니시스 7 방산 국방 드론 구분 주요 종목 ,행복한 딸바보 블로그,blog.naver.com/1vs9,20251013
Seminar,https://blog.naver.com/litwo1018/224039553593,할때 반대하던 사람들은 이제 그 플랫폼으로 일을 한다 지금은 핀테크에 대한 규제가 많지만 조금 더 공부하며 미리 핀테크 업을 시작한 회사의 방법들을 미리 알고 준비한다면 작은 스타트업도 성공 할 수 있다 ,litwo1018님의 블로그,blog.naver.com/litwo1018,20251013
개인회생 끝나고 신용등급 터널의 끝에서 만난 빛,https://blog.naver.com/ivj9850406_gz/224018181428,또한 인터넷 은행이나 일부 핀테크 기업에서는 비교적 신용점수에 너그러운 편이니 이러한 기관들을 활용해 보는 것도 하나의 전략이 될 수 있습니다 과거의 기록 때문에 지레 겁먹기보다는 앞으로의 ,예술의 향기 북풍,blog.naver.com/ivj9850406_gz,20251013
비코노미 사기 Biconamy 코인투자 사칭 피해 주의하세요,https://blog.naver.com/dissocition12385/224039423576,주의하세요 팀미션사기 주식사기 코인사기 스캠사기 사칭사기 공모주사기 투자사기 투자사기대응법 투자사기법적대응 사기피해회복 사기피해대응 사기피해전문변호사 핀테크전문 사기피해전문 ,daylaw 강민성 대표 변호사,blog.naver.com/dissocition12385,20251013
savexa 사기 리딩방 피해 대처 방법과 회복 사칭 ,https://blog.naver.com/lucifer49329/224039550476, 사칭 팀미션사기 주식사기 코인사기 스캠사기 사칭사기 공모주사기 투자사기 투자사기대응법 투자사기법적대응 사기피해회복 사기피해대응 사기피해전문변호사 핀테크전문 사기피해전문 ,데이 강민성 변호사,blog.naver.com/lucifer49329,20251013
인덱스모션 사기 IM indexmotions 사칭 코인 좋아 보일수록 ,https://blog.naver.com/ltent87784/224039548689,조심 팀미션사기 주식사기 코인사기 스캠사기 사칭사기 공모주사기 투자사기 투자사기대응법 투자사기법적대응 사기피해회복 사기피해대응 사기피해전문변호사 핀테크전문 사기피해전문 ,daylaw 강민성 대표 변호사,blog.naver.com/ltent87784,20251013
LS에코에너지 동남아 데이터센터에 첫 버스덕트 수출,https://blog.naver.com/newsnanumy/224039541117,동남아시아는 클라우드 핀테크 확산과 각국 정부의 데이터 현지화 정책으로 글로벌 기업들의 IDC 투자가 빠르게 늘고 있는 핵심 시장이다 특히 베트남은 외국 기업의 데이터센터 100 소유가 가능해 ,나눔경제뉴스 공식 블로그,blog.naver.com/newsnanumy,20251013
비코노미 사기 사칭 코인투자라 속아 순식간에 무너졌다,https://blog.naver.com/unicellulr54589/224039400972,무너졌다 팀미션사기 주식사기 코인사기 스캠사기 사칭사기 공모주사기 투자사기 투자사기대응법 투자사기법적대응 사기피해회복 사기피해대응 사기피해전문변호사 핀테크전문 사기피해전문 ,데이 강민성 변호사,blog.naver.com/unicellulr54589,20251013
토마톡 게임투언으로 재원을 마련하고 스테이킹으로 ,https://blog.naver.com/web3sns/224039535141,국제소통 한국스타트업 핀테크 디지털자산 재무자유 부의추구 미래기술 블록체인다양성 스마트컨트랙트 뉴스 리뷰 카카오톡 아이디 trans01 텔레그램 아이디 Ceotoday 이메일  gmail com,web3sns님의 블로그,blog.naver.com/web3sns,20251013
투나아트 사기 투자 고수익 미끼형 주의해야 합니다 사칭 ,https://blog.naver.com/convulse87018/224039533904, 사칭 팀미션사기 주식사기 코인사기 스캠사기 사칭사기 공모주사기 투자사기 투자사기대응법 투자사기법적대응 사기피해회복 사기피해대응 사기피해전문변호사 핀테크전문 사기피해전문 ,daylaw 강민성 대표 변호사,blog.naver.com/convulse87018,20251013
투나아트 사기 사칭 투자 절대적으로 피해야 할 사항,https://blog.naver.com/dgzuxzgby/224039531309,사항 팀미션사기 주식사기 코인사기 스캠사기 사칭사기 공모주사기 투자사기 투자사기대응법 투자사기법적대응 사기피해회복 사기피해대응 사기피해전문변호사 핀테크전문 사기피해전문 ,데이법률사무소,blog.naver.com/dgzuxzgby,20251013
 투자와인문학 2025 10월 3째주 인문학적 분석 ,https://blog.naver.com/invest_wine_letters/224039528862,스테이블코인 써클 코베 cep 핀테크 업스타트 파가야 세즐 ai 데이터센터 poet nbis nvts 기타 유니티 amd 소송 어부지리 구글 메타 로봇 serv 등등 또 섹터 벌려놓았는데 이 중에서 추려서 집중 ,흐름을 읽는 인문학적 투자,blog.naver.com/invest_wine_letters,20251013
투나아트 사기 사칭 투자라 믿고 돌이킬 수 없게 됐다,https://blog.naver.com/floorcloth85513/224039521628,됐다 팀미션사기 주식사기 코인사기 스캠사기 사칭사기 공모주사기 투자사기 투자사기대응법 투자사기법적대응 사기피해회복 사기피해대응 사기피해전문변호사 핀테크전문 사기피해전문 ,데이 강민성 변호사,blog.naver.com/floorcloth85513,20251013
인덱스모션 사기 IM indexmotions 디파이코인으로 위장한 ,https://blog.naver.com/clevelnd42758/224039509369, 사칭 팀미션사기 주식사기 코인사기 스캠사기 사칭사기 공모주사기 투자사기 투자사기대응법 투자사기법적대응 사기피해회복 사기피해대응 사기피해전문변호사 핀테크전문 사기피해전문 ,clevelnd42758님의 블로그,blog.naver.com/clevelnd42758,20251013
IPO 시장 활황 골드만삭스가 주목한 핀테크 신규 상장주 ,https://blog.naver.com/usipo/224039512127,클라르나 종목 코드 KLAR 는 스웨덴에 본사를 둔 글로벌 핀테크 기업으로 특히 선구매 후결제 BNPL Buy Now Pay Later 솔루션 분야의 시장 리더입니다 무려 1억 1 100만 명의 고객과 스포티파이 삼성 랄프 로렌 ,USIPO - 미국주식 & IT,blog.naver.com/usipo,20251013
미국 및 국내 증시 밸류에이션과 주요 이슈 분석,https://blog.naver.com/kevin_daddy2025/224039508640,네이버는 디지털 자산이나 핀테크 쪽에서 리더십 체계 구축을 통해 신사업 추진력 제고가 가능할 것임 2024년 예상 실적 내년 예상 매출액은 13조 원 정도이며 영업이익은 2 5조 원 정도로 추정됨 ,당신의 인생 길라잡이,blog.naver.com/kevin_daddy2025,20251013
2025년 10월 13일 뉴스,https://blog.naver.com/easyhome_vn/224039507945,베트남은 글로벌 핀테크 추세에 맞춰 조심스럽지만 적극적으로 대응하고자 하는 모습입니다 출처 Crypto market pilot first step towards global fintech integration 베트남뉴스 베트남최신소식 ,"살림의품격, 호치민편",blog.naver.com/easyhome_vn,20251013
개인회생 P2P투자 채무 어떻게 해결해야 할까 ,https://blog.naver.com/why14177/224039502045,최근 들어 핀테크 기술의 발달로 인해 P2P 대출 시장이 급속도로 성장하면서 이로 인한 법적 분쟁이나 금융 사고도 증가하고 있으며 특히 경기 침체기에 접어들면서 연체율 상승과 부실화가 심각한 문제로 ,생생체험 경제동화,blog.naver.com/why14177,20251013
카카오페이 저축 이자 계산 이유와 이해,https://blog.naver.com/elow1957/224039502100,4 금리 정책 변화의 영향 5 상위 금융 상품과의 비교 6 결론 및 제안 7 참고자료 서론 최근 핀테크 이는 은행 저축과 차별성 있는 핀테크 플랫폼의 이자 구조를 이해하면 이유를 알 수 있습니다 이번 ,내가 좋아하는것들,blog.naver.com/elow1957,20251013
금융지주회사의 역할과 디지털 혁신 통한 경쟁력 강화 전략,https://blog.naver.com/vwsfgdrhb/224039500975,빅데이터와 인공지능을 활용해 더욱 정교하고 맞춤형 서비스를 개발하고 핀테크 기업과의 협력을 통해 혁신 핀테크 협력 맞춤형 서비스 개발 금융지주회사 금융혁신 리스크관리 디지털금융 금융산업 ,마하트마 간디,blog.naver.com/vwsfgdrhb,20251013
불확실한 시장 속 숨겨진 보석 글로벌 결제 시스템의 리더 ,https://blog.naver.com/wschatty/224039184485,경쟁 심화 마스터카드 유니온페이 등 기존 경쟁사는 물론 핀테크 기업이나 빅테크 기업들의 자체 비자 Visa V 미국주식 결제시스템 핀테크 디지털결제 글로벌경제 인프라기업 강력한해자 주식투자 ,월가 뒷골목 수다쟁이,blog.naver.com/wschatty,20251013
비코노미 사기 biconamy 코인투자라 속인 정교한 신뢰조작 ,https://blog.naver.com/crnivorous20772/224039433470, 사칭 팀미션사기 주식사기 코인사기 스캠사기 사칭사기 공모주사기 투자사기 투자사기대응법 투자사기법적대응 사기피해회복 사기피해대응 사기피해전문변호사 핀테크전문 사기피해전문 ,데이 강민성 변호사,blog.naver.com/crnivorous20772,20251013
2025년 KICXUP 서울 입주기업 모집공고 제4차 ,https://blog.naver.com/preeom/224039495944,서울핀테크랩 x KT amp KTCS 서울핀테크랩 대상 전체 연령 전체 2025 10 02 2025 10 2123 59 제주특별자치도 멘토링 컨설팅 교육 2025 6회 호남권 엔젤투자톡톡 in 제주 참가기업 모집 안내 ,세월부대인(歲月不待人),blog.naver.com/preeom,20251013
카카오뱅크 리포트 분석 2025 10 13 대신증권 ,https://blog.naver.com/investock_/224039495080,09 윤호영 대표 서울 핀테크 위크 에서 원화 스테이블코인 중요성 언급 또한 국회에서도 디지털자산 TF 출범 2025 09 24 및 스테이블코인 관련 법안 5건 발의 등 제도적 논의가 ,내가 궁금한 이슈노트,blog.naver.com/investock_,20251013
BIG DEAL 이번 주 투자 유치 기업 4곳,https://blog.naver.com/preeom/224039494007,코리아핀테크위크 핀테크 생태계 총결산 11월 컴업2025 중소벤처기업부 스타트업 종합 페스티벌 기관별 데모데이 일정 주최 유형 일정 CJ오벤터스 대기업 10 12월 중 관악S밸리 자치구 10 12월 중 ,세월부대인(歲月不待人),blog.naver.com/preeom,20251013
13 Oktober 2025 Montag 블록체인 gt 스테이블코인 ,https://blog.naver.com/skydreamingdee/224039477407,인출 핀테크 기업 JPYC Nudge card 엔 기반의 스테이블코인 JPYC 로 신용카드 대금을 상환 라인 자체 스테이블코인 활성화로 엔화존 구상 미국 비자 실시간 개인 간 P2P 송금서비스 비자 다이렉트 에 ,sunshine indeed!,blog.naver.com/skydreamingdee,20251013
카카오 주가 단기 핵심 전략 ,https://blog.naver.com/hjy_investor/224039476811,AI 톡비즈 핀테크 중심의 핵심 플랫폼 구조 강화 기술적 흐름 59 000원 지지선 확인 62 000원 저항 이는 142개까지 불어났던 문어발식 구조에서 벗어나 AI 톡비즈 핀테크 중심의 구조 재편으로 ,HjY INVESTOR,blog.naver.com/hjy_investor,20251013
CBDC 도입 2025년 한국은행 계획과 우리의 미래는 ,https://blog.naver.com/start230509/224039471901,핀테크 기업들은 CBDC를 활용하여 더욱 혁신적인 금융 서비스를 개발할 수 있을 것이고 소비자들은 풍경 CBDC 한국은행 디지털화폐 2025년 대국민실험 블록체인 핀테크 디지털경제 금융혁신 ,알뜰살뜰_경제파트너,blog.naver.com/start230509,20251013
인덱스모션 사기 IM indexmotions 사칭 코인 투자라 속아 ,https://blog.naver.com/resilient77515/224039464766,자산 팀미션사기 주식사기 코인사기 스캠사기 사칭사기 공모주사기 투자사기 투자사기대응법 투자사기법적대응 사기피해회복 사기피해대응 사기피해전문변호사 핀테크전문 사기피해전문 ,데이 강민성 변호사,blog.naver.com/resilient77515,20251013
인덱스모션 사기 IM Indexmotions 투자 정교하게 위장된 ,https://blog.naver.com/frngible82663/224039458662, 사칭 팀미션사기 주식사기 코인사기 스캠사기 사칭사기 공모주사기 투자사기 투자사기대응법 투자사기법적대응 사기피해회복 사기피해대응 사기피해전문변호사 핀테크전문 사기피해전문 ,daylaw 강민성 대표 변호사,blog.naver.com/frngible82663,20251013
네이버 주가전망 AI 클라우드 블록체인으로 다시 주목받는 ,https://blog.naver.com/bullspo/224039450092,현재 장중 주가는 264 500원선에서 거래 중이며 검색 광고를 넘어 AI 클라우드 핀테크 콘텐츠 3 핀테크 블록체인 네이버페이 기반 간편결제 서비스 라인블록체인 토코토코 Toktok 등 디지털 자산 ,AI경제 로보캅,blog.naver.com/bullspo,20251013
칠곡3지구 영어학원 Day 080 하루 한 수 사관학교가 묻는 ,https://blog.naver.com/kcms723/224039447613,핀테크 스타트업을 시작하는 것은 매우 가변적이고 예측할 수 없는 환경에 직면하는 것이지만 더 많은 투자를 요청할 수 있는 옵션이 항상 있다 8 이것도 위에서처럼 but ,한수높은 수능영어[김철영어 칠곡],blog.naver.com/kcms723,20251013
카카오페이 혜택 몰랐던 3가지 3 할인 받는 초간단 비밀,https://blog.naver.com/economania7/224038362424,추천 해시태그 카카오페이 카카오페이혜택 카카오페이할인 모바일결제 간편결제 GS25할인 티빙할인 페이포인트 재테크꿀팁 생활꿀팁 앱테크 초보자가이드 노하우 실용팁 핀테크 ,economania7님의 블로그,blog.naver.com/economania7,20251013
savexa 사기 사칭 CFD 차익거래 투자 대처하는 방법,https://blog.naver.com/mgreatmaild18/224039443079,방법 팀미션사기 주식사기 코인사기 스캠사기 사칭사기 공모주사기 투자사기 투자사기대응법 투자사기법적대응 사기피해회복 사기피해대응 사기피해전문변호사 핀테크전문 사기피해전문 ,daylaw,blog.naver.com/mgreatmaild18,20251013
 About Middle East 10월 13일 중동소식,https://blog.naver.com/tpmea/224039239650, 리플 XRP 바레인 핀테크 베이와 파트너십 체결 중동 진출 가속화 http m g enews com article Securities 2025 10 202510100607575845e250e8e188 1 리플은 바레인 최대의 핀테크 허브인 바레인 핀테크 ,Turning Point MEA,blog.naver.com/tpmea,20251013
투자자들이 주목할 테마주 leading theme stocks ,https://blog.naver.com/help2000/224039427428,FinTech 핀테크 HOOD SOFI OPEN 로빈후드 HOOD 소파이 SOFI 등 신금융 플랫폼 기업 AVs 자율주행차 TSLA PONY OUST 테슬라 TSLA 중심 OUST는 라이다 센서 PONY는 자율주행 스타트업 Rare Earths ,지식 한 스푼,blog.naver.com/help2000,20251013
Savexa 사기 CFD 차액거래를 내세운 치밀한 투자 유혹의 ,https://blog.naver.com/crnivorous20772/224039413600, 사칭 팀미션사기 주식사기 코인사기 스캠사기 사칭사기 공모주사기 투자사기 투자사기대응법 투자사기법적대응 사기피해회복 사기피해대응 사기피해전문변호사 핀테크전문 사기피해전문 ,데이 강민성 변호사,blog.naver.com/crnivorous20772,20251013
savexa 사기 차액거래 절대 믿지 마세요 당신 돈을 노린다 ,https://blog.naver.com/emsculte79299/224039417893, 사칭 팀미션사기 주식사기 코인사기 스캠사기 사칭사기 공모주사기 투자사기 투자사기대응법 투자사기법적대응 사기피해회복 사기피해대응 사기피해전문변호사 핀테크전문 사기피해전문 ,daylaw 강민성 대표 변호사,blog.naver.com/emsculte79299,20251013
Savexa 사기 CFD 차액거래 투자 주의해야 하는 이유 사칭 ,https://blog.naver.com/dissocition12385/224039414709, 사칭 팀미션사기 주식사기 코인사기 스캠사기 사칭사기 공모주사기 투자사기 투자사기대응법 투자사기법적대응 사기피해회복 사기피해대응 사기피해전문변호사 핀테크전문 사기피해전문 ,daylaw 강민성 대표 변호사,blog.naver.com/dissocition12385,20251013
다우기술 주가 클라우드와 결제 플랫폼 성장 전망,https://blog.naver.com/yuun_stay/224039412851,또한 간편 결제 시장의 폭발적인 성장과 온라인 결제 트래픽 증가에 따라 핀테크 및 디지털 금융 관련 실적 개선이 기대됩니다 자체 금융 IT 솔루션 개발 및 운영 노하우를 바탕으로 결제 플랫폼 사업 영역을 ,재테크와 생활리뷰 홀릭,blog.naver.com/yuun_stay,20251013
거대 성간 물체 3I ATLAS 미스터리 그리고 IT 보안 대격변,https://blog.naver.com/robotaiitnews/224039412337,마지막으로 러시아의 핀테크 분야에서도 흥미로운 발전이 포착되었습니다 러시아의 VTB 은행은 iOS26 리퀴드글래스 애플인텔리전스 협동로봇 핀테크 디지털루블 생체인식결제 IT보안 기술분석,기술인가 빅뱅인가,blog.naver.com/robotaiitnews,20251013
카드 혜택으로 매달 공과금 3 5만원 절약하기,https://blog.naver.com/candypay/224039410827,안녕하세요 캔디페이입니다 매달 빠져나가는 전기요금 가스비 통신비 고정 지출이라고 그냥 내고 계신가요 똑똑한 카드 선택 캔디페이 분할결제 실적 관리로 연간 최대 40만원 이상 아낄 수 ,캔디페이,blog.naver.com/candypay,20251013
토스 신화 홍민택 카톡 빅뱅 실패와 나무위키 논란 속에서 ,https://blog.naver.com/gjhomecare/224039403032,자료출처 파이낸셜뉴스 핀테크 업계를 주름잡던 인물이 카카오에서 겪은 도전을 깊이 핀테크 전문가의 시각에서 본 혁신의 양면성을 함께 고민해 보시죠 자료출처 이코노미스트 핀테크 전문가의 탄생 ,남씨가족 이야기,blog.naver.com/gjhomecare,20251013
20251013 200만원 미국주식 구매,https://blog.naver.com/littlebodybigheart_/224039396129,핀테크에 신규상장기업이라 무섭지 않냐고 당연히 무섭다 그치만 SOFI나 HOOD 같은 신규 상장 핀테크 기업도 역사적 저점을 상장 후에 상장가의 50 보다 더 떨어지고 바닥을 다지면서 올랐다 물론 ,조형진,blog.naver.com/littlebodybigheart_,20251013
Savexa 사기 사칭 CFD 투자라 믿고 모든 걸 잃었다,https://blog.naver.com/unicellulr54589/224039396763,잃었다 팀미션사기 주식사기 코인사기 스캠사기 사칭사기 공모주사기 투자사기 투자사기대응법 투자사기법적대응 사기피해회복 사기피해대응 사기피해전문변호사 핀테크전문 사기피해전문 ,데이 강민성 변호사,blog.naver.com/unicellulr54589,20251013
신용장 지급거절 정당했을까 은행의 지급거절 사유와 대응 전략,https://blog.naver.com/legal_lemonade/224039386559,About the Authour 국내 대형은행 법무팀에서 10년 이상 국제금융 신용장 영문계약서 및 외국환규제 자문 등을 담당하고 핀테크 기업에서 해외 지급결제와 해외 진출 등 다양한 프로젝트를 수행한 미국 ,리걸 레몬에이드,blog.naver.com/legal_lemonade,20251013
 쿠콘뉴스 10월 셋째 주 핀테크 최신 동향 정리,https://blog.naver.com/cooconportal/224039380898, QR 하나로 결제 OK 금융권 해외결제 편의성 강화 집중 해외여행 수요와 외국인 관광객 유입이 늘면서 금융권은 해외결제 편의성 강화에 집중하고 있다 은행과 빅테크 기업 모두 QR코드를 ,쿠콘,blog.naver.com/cooconportal,20251013
응우옌 람 중 회장 VPS는 단순한 증권회사가 아니라 핀테크의 ,https://blog.naver.com/20000kim/224039372606, quot 라고 말하며 이 기업이 거의 10년 동안 꾸준히 추구해 온 발전 방향 즉 진정한 금융 기술 핀테크 증권사에서 핀테크로 VPS는 단순한 브로커나 투자 서비스 제공업체가 아닌 기술이 개발의 중심축이 ,관보아빠의 베트남 주식 투자 & 경제 이야기,blog.naver.com/20000kim,20251013
세무 리스크 없는 사업 해외송금 하려면 유트랜스퍼Biz로 ,https://blog.naver.com/utransfer2018/224028459334,반면 유트랜스퍼Biz는 글로벌 핀테크망 이용으로 은행 대비 80 이상 낮은 수수료와 실시간 환율 혁신적인 핀테크 서비스를 찾고 있습니다 그 이유는 무엇일까요 안전성 해외송금 라이선스 한국 ,유트랜스퍼 공식 블로그,blog.naver.com/utransfer2018,20251013
