title,link,description,bloggername,bloggerlink,postdate
NAVER 주가 전망 목표주가와 재무제표까지 분석 지금 ,https://blog.naver.com/romantic_comedy_life/224040476869,AI 클라우드 핀테크 등 신성장동력 사업 확장으로 다시 반등세를 보이고 있습니다 오늘은 광고 핀테크 클라우드 콘텐츠 등 최근 동향 네이버는 AI 기술 고도화 를 핵심 ,로코라이프 경제 블로그,blog.naver.com/romantic_comedy_life,20251014
카카오뱅크 오늘의퀴즈 카카오뱅크 퀴즈정답 10월 14일 8시,https://blog.naver.com/chip8076/224040473064,카카오뱅크의 플랫폼 경쟁력과 핀테크 전략 제목 모바일 금융 혁신 카카오뱅크의 비대면 금융 매달 생활비 돌려받기 와 같은 서비스는 이러한 핀테크 경쟁력을 보여주는 단적인 예시입니다 3 1 ,똑답 - 똑똑한 돈버는 퀴즈정답 사이트,blog.naver.com/chip8076,20251014
 네카오 평이한 3분기 예상 4분기 네카오 모두 기대,https://blog.naver.com/won2582/224040470032, 스테이블코인 제도화 시 국민과의 접점 및 핀테크 역량을 바탕으로 유통 경쟁력을 갖출 수 있는 플랫폼도 결국 NAVER와 카카오다 1 AI 정책 소버린 AI 클라우드 관련 사업을 영위하고 2 ,자이로콰이,blog.naver.com/won2582,20251014
내가 레미틀리 글로벌에 투자한이유 미국투자일지 ,https://blog.naver.com/valueflowmind/224040248546,회사개요 레미틀리 글로벌 Remittly Global Inc RELY 레미틀리 글로벌 Remittly 는 글로벌 송금 서비스를 제공하는 핀테크 기업으로 스마트폰 앱을 통해 이민자 및 해외 노동자들이 자국에 돈을 쉽게 보낼 ,플로우멘티 님의 블로그,blog.naver.com/valueflowmind,20251014
 10월14일 꿈밍이의 아침브리핑,https://blog.naver.com/ggumlog/224040468317,플랫폼 콘텐츠 핀테크 NAVER NHN KCP 케이씨에스 NAVER는 AI 검색과 라인야후 재편 기대감 NHN KCP는 소비 회복 기반 전자결제주 반등 케이씨에스는 암호화폐 핀테크 테마로 단기 모멘텀 부각 바이오 ,꿈밍이의 경제 놀이터,blog.naver.com/ggumlog,20251014
블록체인 기술이 금융 시스템을 바꾸는 방식,https://blog.naver.com/ho87623/224038583193,법적 제도적 장치 마련 필요 기술 표준화 부족 일반 사용자 접근성 개선 보안 사고 대응 체계 구축 그럼에도 불구하고 글로벌 은행과 핀테크 기업 정부 기관까지 블록체인에 주목하고 있으며 앞으로 5년 ,Junsh,blog.naver.com/ho87623,20251014
하나금융지주 주식 10년간 배당금 역사와 핵심 이슈 정리 ,https://blog.naver.com/joylove_u/224030439791,하나금융지주 주식 투자 배당 외에 주목할 이슈 고금리 환경 은행 이자이익 확대 효과 지속 가계부채 관리 금융당국 규제 강화 가능성 디지털 금융 확대 핀테크 경쟁력 강화 비용 절감 효과 글로벌 ,"경제의 과거와 현재, 미래",blog.naver.com/joylove_u,20251014
 Google Cloud 클라르나 Klarna 와의 전략적 AI 파트너십 ,https://blog.naver.com/inter200_200/224040465790,진화한 핀테크 분야의 거대 기업입니다 이미 자사의 고객 서비스 챗봇에 AI를 도입하여 전체 및 핀테크 산업에서 얼마나 강력한 가치를 창출할 수 있는지를 입증하는 중요한 성공 사례 Success ,LLM(AI) 전문 - Microsoft AI MVP,blog.naver.com/inter200_200,20251014
트럼프 새로운 중동의 역사적 새벽 가자전쟁 끝났다 ,https://blog.naver.com/greatwisdomperfect/224040463750,스테이블 코인 제도화 및 핀테크 관련주 NHN KCP 주봉 주요 내용 구현철 부총리는 공공기관 통폐합 등 정부 구조 개편 방향을 밝히는 한편 스테이블 코인 도입을 자본 유출입 리스크를 보완하며 혁신적인 ,"수익은 길게, 손실은 짧게",blog.naver.com/greatwisdomperfect,20251014
카카오페이 주가 전망 금리 인하 기대에 반등 신호 포착될까 ,https://blog.naver.com/vipro/224040422483,대표 핀테크 플랫폼이다 이런 성장형 기업들은 금리가 높은 시기에는 미래 이익의 가치가 할인되어 단기적인 변동성은 있겠지만 중장기적으로 카카오페이는 한국 핀테크 산업을 대표하는 핵심 성장주로 ,스토리텔러 지델롱,blog.naver.com/vipro,20251014
SK텔레콤 자급제 전용 요금제 Air 출시 약정 보조금 ,https://blog.naver.com/futuretechinsights/224040438769,SK텔레콤이 새로운 자급제 전용 요금제 브랜드 Air 에어 를 공식 출시했습니다 Air 는 기존 이동통신사의 복잡한 요금 체계와 약정 보조금 중심의 구조에서 벗어나 심플하고 디지털 중심적인 ,FutureTech Insights,blog.naver.com/futuretechinsights,20251014
광주은행 햇살론15 신청자격과 재대출 후기,https://sibauchi.tistory.com/1145,그리고 핀테크의 성장이라는 삼중고를 겪었습니다 금리 인상은 대출 수요를 위축시키고 연체율 핀테크 기업들은 간편한 대출 심사 및 실행 시스템을 통해 시장 점유율을 확대하고 있지만 고금리 논란과 ,Falconer's Teatime :: 이제는 말하고 말겠다-라멘토 비평,https://sibauchi.tistory.com/,20251014
 100개 주식의 오늘 10월 14일 증시 대탐험 ,https://blog.naver.com/cjrnrdmlskan/224040436480,NAVER 262 500원 플랫폼 콘텐츠 핀테크 등 다각화된 사업 구조가 장점이자 복잡성 요소 기아 101 핀테크 경쟁력과 규제 흐름이 중요하다 삼양식품 1 429 000원 식품 사업 중심 소비 흐름 변화에 ,혀기쿠기,blog.naver.com/cjrnrdmlskan,20251014
 10월 14일 대한민국 증시 하이라이트 30개 주식의 오늘과 ,https://blog.naver.com/cjrnrdmlskan/224040435390,포털 콘텐츠 핀테크 등 여러 축을 가진 NAVER 인터넷 경제의 흐름 변화와 함께 수익 구조 변화가 메신저 플랫폼 핀테크 모빌리티까지 카카오는 여러 사업 축을 긋고 있다 12 2차전지 소재 기업 ,혀기쿠기,blog.naver.com/cjrnrdmlskan,20251014
중국이 한국 국채 주식 부동산을 사들이는 이유는 ,https://blog.naver.com/h2otube/224026638318,토스 핀테크 ETF 등 국채 금리와 채권형 펀드 중국 매도 시 금리 상승 가능 금리 변동성에 따른 채권 자금유입과리스크 핀테크중국투자 경제블로그 2025산업트렌드 한국주식중국자본 부동산투자이슈 ,h2otube님의 블로그,blog.naver.com/h2otube,20251014
스테이블코인 이제 누가 어떻게 허가하고 무엇을 지켜야 ,https://blog.naver.com/topec_eng/224040429132,gov 현실 뉴욕 등 주 별 라이선스와 카드 핀테크 파트너십으로 달러 스테이블코인 우위 지속 6 일부 12 전면 시행 SBSB 핀테크 변호사 영국 적격 스테이블코인 발행 커스터디 허가 결제 ,AX leader,blog.naver.com/topec_eng,20251014
 개인 중심 금융은 끝났다 이제는 가족 단위 플랫폼 경쟁 ,https://blog.naver.com/futuretechinsights/224040428790,은행 카드사 핀테크 기업들이 앞다투어 가족 단위 자산관리 서비스를 내놓고 있죠 이는 단순히 한 사람의 고객을 붙잡는 것이 아니라 가족 전체를 하나의 고객 생태계로 묶어 장기 관계를 형성하려는 ,FutureTech Insights,blog.naver.com/futuretechinsights,20251014
 산업 기업 직무분석 시리즈 45 핀테크 디지털 금융 취업 ,https://blog.naver.com/jobmasterplan/223988807886,서론 왜 핀테크 디지털 금융 산업인가 핀테크 디지털 금융 산업은 금융과 기술의 융합으로 빠르게 성장하며 금융 서비스의 패러다임을 바꾸고 있습니다 결제 송금 간편결제 해외송금 전자지갑 ,"취업 마스터 플랜, 면접부터 합격까지",blog.naver.com/jobmasterplan,20251014
 2025년10월14일 화요일 미장 정리 amp 국장 준,https://blog.naver.com/krcn1215/224040423917,코인 상승은 일부 게임 핀테크 관련주에 시행착오성 모멘텀 제공 5 오늘 트레이딩 포인트 한국 투자자용 핵심 인사이트 3가지 반도체 AI 관련 종목은 단기 모멘텀 강하지만 이벤트 리스크 존재 ,lagom,blog.naver.com/krcn1215,20251014
신용사면 대상자 조회 방법 및 조건 나도 회복 가능할까 ,https://blog.naver.com/whitetree1288/224038430106,나이스평가정보 NICE 코리아크레딧뷰로 KCB 등 신용평가사 홈페이지는 물론 토스 Toss 와 같은 핀테크 앱의 관련 메뉴를 통해서도 간편하게 조회가 가능합니다 이미 상환을 완료한 약 258만 명은 즉시 ,"망고머니랩, 사업자금 • 정책자금 • 레버리지",blog.naver.com/whitetree1288,20251014
2026년 100 이상 쏴줄 주식 레드와이어 종목추천 및 ,https://blog.naver.com/jusik_men/224040421616,레드와이어 Redwire 기업 심층 분석 우주 인프라에서 국방 기술 강자로의 도약 I 요약 본 보고서는 레드와이어 Redwire Corporation NYSE RDW 에 대한 종합적인 분석을 제공한다 레드와이어는 유산과 혁신 ,누라두의 세계 주식정보 방,blog.naver.com/jusik_men,20251014
말레이시아 vs 한국 직장인 평균 연봉 물가 경제규모 ,https://blog.naver.com/lifetraveller/224040419934,핀테크 이슬람 금융 리스크 규제 결제 7 석유 가스 프로세스 HSE 무결성관리 회수개선 8 금융 핀테크 퀀트 리스크 11 공기업 공공데이터 정책 감사 12 콘텐츠 이벤트 관광 플랫폼 7 ,여행 정보,blog.naver.com/lifetraveller,20251014
말라위 vs 한국 직장인 평균 연봉 물가 경제규모 최저임금 ,https://blog.naver.com/lifetraveller/224040418734,통신 모바일 핀테크 MFS 운영 에이전트 네트워크 현장 영업 10 식품 안전 검사 표준 품질 규격 금융 핀테크 리스크 퀀트 11 스마트시티 인프라 교통체계 12 콘텐츠 스포츠 MICE 13 ESG ,여행 정보,blog.naver.com/lifetraveller,20251014
마카오 vs 한국 직장인 평균 연봉 물가 경제규모 최저임금 ,https://blog.naver.com/lifetraveller/224040417366,현대 금융 리스크 규제 결제 핀테크 백오피스 10 빅헬스 전통의학 연계 R amp D 임상보조 운영 11 핀테크 결제 리스크 퀀트 리걸테크 11 콘텐츠 라이브이벤트 스포츠 관광 12 도시 인프라 ,여행 정보,blog.naver.com/lifetraveller,20251014
4대보험 미가입자 대환대출 최적의 시기 선택 방법,https://blog.naver.com/mgaoften/224040417049,온라인 플랫폼 비교 핀테크 기업들이 제공하는 대출 비교 플랫폼을 활용하면 여러 금융기관의 대출 상품을 한 번에 비교할 수 있습니다 시간과 노력을 절약하고 자신에게 맞는 최적의 상품을 찾는데 도움이 ,바를정 대출정보,blog.naver.com/mgaoften,20251014
 성투 2025년 10월 14일 장전아침시황 모닝브리핑 주식시황 ,https://blog.naver.com/3030stockstory/224040416530,관련주 NAVER NHN KCP 뱅크웨어글로벌 등 네 카 토 지분 쥔 증권사들 스테이블코인 수혜 꽃놀이패 방긋 네이버 카카오 토스 등 이른바 국내 대표 핀테크 계열사 지분을 보유한 증권사들이 ,"계좌수복, 너도 할 수 있어",blog.naver.com/3030stockstory,20251014
마이크로네시아 vs 한국 직장인 평균 연봉 물가 경제규모 ,https://blog.naver.com/lifetraveller/224040415614,금융핀테크 공공 경제규모와 산업구조 한국 명목 GDP는 최근치 기준 약 1조7천억 달러대 수출 금융 핀테크 데이터리스크 규제테크 결제 여신 IT 퀀트가 유망합니다 10 공기업 공공기관 에너지 ,여행 정보,blog.naver.com/lifetraveller,20251014
마셜제도 vs 한국 직장인 평균 연봉 물가 경제규모 최저임금 ,https://blog.naver.com/lifetraveller/224040414098,금융 핀테크 콘텐츠 2 경제규모와 구조 비교 한국 명목 GDP 약 1 71조 달러 2023년 수출 주도형 금융 핀테크 데이터리스크 퀀트 규제테크 10 공기업 공공기관 에너지 인프라 정책집행 지원 팁 ,여행 정보,blog.naver.com/lifetraveller,20251014
사업자대환대출 금리 비교 핵심 꿀팁 완벽 분석,https://blog.naver.com/mgaoften/224040412854,온라인 금리 비교 플랫폼 활용 은행연합회 소비자포털 핀테크 업체의 대출 비교 플랫폼 등 온라인에서 다양한 금융기관의 대출 상품을 한눈에 비교할 수 있습니다 간단한 정보 입력만으로 예상 금리와 한도를 ,바를정 대출정보,blog.naver.com/mgaoften,20251014
2025년 10월14일 화 보험인기 검색어,https://blog.naver.com/dailynewsbriefing/224040405761,사이버보안 핀테크 디지털전환 ESG경영 사회적책임투자 윤리적소비 가치소비 친환경 제로웨이스트 비건 동물복지 공정무역 기부 후원 봉사 나눔 상생 협력 소통 공감 존중 배려 이해 관용 정의 ,노주영의 5분 뉴스브리핑&보험소식,blog.naver.com/dailynewsbriefing,20251014
보험설계사 제보 제대로 된 보험생활 ,https://blog.naver.com/dailynewsbriefing/224040405156,사이버보안 핀테크 디지털전환 ESG경영 사회적책임투자 윤리적소비 가치소비 친환경 제로웨이스트 비건 동물복지 공정무역 기부 후원 봉사 나눔 상생 협력 소통 공감 존중 배려 이해 관용 정의 ,노주영의 5분 뉴스브리핑&보험소식,blog.naver.com/dailynewsbriefing,20251014
2025년 10월13일 월 오늘의 5분 생활소식,https://blog.naver.com/dailynewsbriefing/224040404681,사이버보안 핀테크 디지털전환 ESG경영 사회적책임투자 윤리적소비 가치소비 친환경 제로웨이스트 비건 동물복지 공정무역 기부 후원 봉사 나눔 상생 협력 소통 공감 존중 배려 이해 관용 정의 ,노주영의 5분 뉴스브리핑&보험소식,blog.naver.com/dailynewsbriefing,20251014
2025년 10월14일 화 오늘의 5분 생활소식,https://blog.naver.com/dailynewsbriefing/224040404884,사이버보안 핀테크 디지털전환 ESG경영 사회적책임투자 윤리적소비 가치소비 친환경 제로웨이스트 비건 동물복지 공정무역 기부 후원 봉사 나눔 상생 협력 소통 공감 존중 배려 이해 관용 정의 ,노주영의 5분 뉴스브리핑&보험소식,blog.naver.com/dailynewsbriefing,20251014
2025년 10월14일 화 오늘의 1분 시사 경제 상식,https://blog.naver.com/dailynewsbriefing/224040403691,사이버보안 핀테크 디지털전환 ESG경영 사회적책임투자 윤리적소비 가치소비 친환경 제로웨이스트 비건 동물복지 공정무역 기부 후원 봉사 나눔 상생 협력 소통 공감 존중 배려 이해 관용 정의 ,노주영의 5분 뉴스브리핑&보험소식,blog.naver.com/dailynewsbriefing,20251014
2025년 10월13일 월 오늘의 1분 시사 경제 상식,https://blog.naver.com/dailynewsbriefing/224040403517,사이버보안 핀테크 디지털전환 ESG경영 사회적책임투자 윤리적소비 가치소비 친환경 제로웨이스트 비건 동물복지 공정무역 기부 후원 봉사 나눔 상생 협력 소통 공감 존중 배려 이해 관용 정의 ,노주영의 5분 뉴스브리핑&보험소식,blog.naver.com/dailynewsbriefing,20251014
2026년 트렌드코리아 요약본,https://blog.naver.com/dailynewsbriefing/224040402888,사이버보안 핀테크 디지털전환 ESG경영 사회적책임투자 윤리적소비 가치소비 친환경 제로웨이스트 비건 동물복지 공정무역 기부 후원 봉사 나눔 상생 협력 소통 공감 존중 배려 이해 관용 ,노주영의 5분 뉴스브리핑&보험소식,blog.naver.com/dailynewsbriefing,20251014
2025년 10월14일 화 노주영의 보험 뉴스 링크 소식,https://blog.naver.com/dailynewsbriefing/224040402341,사이버보안 핀테크 디지털전환 ESG경영 사회적책임투자 윤리적소비 가치소비 친환경 제로웨이스트 비건 동물복지 공정무역 기부 후원 봉사 나눔 상생 협력 소통 공감 존중 배려 이해 관용 정의 ,노주영의 5분 뉴스브리핑&보험소식,blog.naver.com/dailynewsbriefing,20251014
2025년10월14일 화 노주영 5분뉴스브리핑 amp 보험소식 ,https://blog.naver.com/dailynewsbriefing/224040401260,사이버보안 핀테크 디지털전환 ESG경영 사회적책임투자 윤리적소비 가치소비 친환경 제로웨이스트 비건 동물복지 공정무역 기부 후원 봉사 나눔 상생 협력 소통 공감 존중 배려 이해 관용 정의 ,노주영의 5분 뉴스브리핑&보험소식,blog.naver.com/dailynewsbriefing,20251014
2025년10월13일 월 노주영 5분뉴스브리핑 amp 보험소식 10월 ,https://blog.naver.com/dailynewsbriefing/224040401022,사이버보안 핀테크 디지털전환 ESG경영 사회적책임투자 윤리적소비 가치소비 친환경 제로웨이스트 비건 동물복지 공정무역 기부 후원 봉사 나눔 상생 협력 소통 공감 존중 배려 이해 관용 정의 ,노주영의 5분 뉴스브리핑&보험소식,blog.naver.com/dailynewsbriefing,20251014
2025년10월2일 목 노주영 5분뉴스브리핑 amp 보험소식,https://blog.naver.com/dailynewsbriefing/224040400381,사이버보안 핀테크 디지털전환 ESG경영 사회적책임투자 윤리적소비 가치소비 친환경 제로웨이스트 비건 동물복지 공정무역 기부 후원 봉사 나눔 상생 협력 소통 공감 존중 배려 이해 관용 정의 ,노주영의 5분 뉴스브리핑&보험소식,blog.naver.com/dailynewsbriefing,20251014
2025년10월1일 수 노주영 5분뉴스브리핑 amp 보험소식 10월 ,https://blog.naver.com/dailynewsbriefing/224040400050,사이버보안 핀테크 디지털전환 ESG경영 사회적책임투자 윤리적소비 가치소비 친환경 제로웨이스트 비건 동물복지 공정무역 기부 후원 봉사 나눔 상생 협력 소통 공감 존중 배려 이해 관용 정의 ,노주영의 5분 뉴스브리핑&보험소식,blog.naver.com/dailynewsbriefing,20251014
 달러패권 9장면 디지털 달러와 스테이블코인 코드로 진화한 ,https://blog.naver.com/red2x2/224036785614,미국 유럽의 B2B 결제와 핀테크 DeFi Decentralizaed Finance 탈중앙화 금융 연동 영역에서 국채 중심의 고품질 준비금과 투명한 공시를 앞세워 규제 친화성을 확보하였고 그 결과 전통 금융과 연결된 제도권 ,이설아빠의 Global Business Story,blog.naver.com/red2x2,20251014
10월 14일 카카오페이 퀴즈 정답,https://blog.naver.com/answernow_/224039873357,카카오페이 입장에서는 자사의 이미지를 글로벌 핀테크 플랫폼 으로 성장시키는 게 중요한 전략 중 하나예요 이런 전략이 실생활 속 콘텐츠에도 녹아들고 있기 때문에 퀴즈타임 역시 이 세계화된 흐름을 ,지금 이 순간,blog.naver.com/answernow_,20251014
투자의 미래를 여는 열쇠 디지털 자산 알아보기 ,https://blog.naver.com/jaysalon/224037601407,비트코인 NFT 대체 불가능 토큰 그리고 최근 큰 화두가 되고 있는 토큰증권 STO 까지 우리는 지금 디지털 자산 Digital Asset 이라는 새로운 경제 패러다임의 한가운데에 서 있습니다 더 이상 종이 서류나 실물 ,김제이님의 블로그,blog.naver.com/jaysalon,20251014
네이버 VS 카카오 왜 안오르지 스트레스 주식,https://blog.naver.com/eyhs80/224040392311,플랫폼 중심 사업 구조 카카오톡이라는 강력한 메신저 기반이 있고 이 위에 광고 커머스 핀테크 카카오페이 등 콘텐츠 등 여러 사업을 붙여 놓고 있어요 플랫폼 구조라는 게 사용자 기반이 많으면 추가 ,정보는 본느 좋은 정보,blog.naver.com/eyhs80,20251014
근로복지공단 의료비대출 신청절차와 이용조건 정리,https://think-tank.tistory.com/894,그리고 핀테크 기업의 등장 등 다양한 요인에 의해 끊임없이 변화해왔습니다 특히 금리 인상은 대출 핀테크 기술을 활용한 맞춤형 대출 상품이 증가하고 온라인 플랫폼을 통한 접근성이 향상될 것입니다 ,think-tank.tistory.com,https://think-tank.tistory.com/,20251014
정부지원 서민대출 아는 사람만 챙겨가는 꿀팁 서민금융대출 ,https://blog.naver.com/grijoa0/224035563350,특히 요즘은 토스나 카카오뱅크 같은 핀테크 앱에서도 일부 상품 조회가 가능하니까 정말 편해졌어요 터치 몇 번만으로 내 한도를 바로 확인할 수 있거든요 물론 서류 증빙이 어렵거나 좀 더 깊은 상담이 ,Money Bridge와 함께 자산투자,blog.naver.com/grijoa0,20251014
 SkyKick 판결 영국 상표 출원 시 악의 에 의한 상표 등록 ,https://blog.naver.com/sun_patent/224033985361,둘 전자상거래 핀테크처럼 여러 클래스가 얽히는 플랫폼형 비즈니스 셋 투자 라운드를 앞두고 범위가 커 보이는 명세를 선호하는 경우입니다 현실에 맞는 범위 설계와 근거 마련이 필수입니다 ,신선 변리사의 스타트업 IP 전략 & 컨설팅,blog.naver.com/sun_patent,20251014
두바이 GITEX Global 2025 The 45th Edition,https://blog.naver.com/rud529/224040380698,및 핀테크 스마트시티 클라우드 데이터 네트워크 기술 스타트업 amp 벤처 투자 Expand North Star 금융 핀테크 스마트시티 디지털 도시 블록체인 Web3 에너지 전환 헬스테크 바이오 ,달리는 유럽여행 ㅣ 푸사장의 달달한 유럽 여행꿀팁,blog.naver.com/rud529,20251014
그래서 스테이블코인이 뭔데 ,https://blog.naver.com/yoojinpooh/224040380667,대기업과 핀테크의 잠재적 움직임 p245 초보자를 위한 현실적 조언 1 잃어도 되는 만큼만 투자하라 2 검증된 프로토콜먼 사용하라 3 분산 투자하라 4 복잡한 전략은 피하라 5 가스비를 고려하라 p275 ,The나은책방,blog.naver.com/yoojinpooh,20251014
AI 전력 대란과 핀테크 거장의 갑작스러운 부재,https://blog.naver.com/begin_of_empathy/224040380280,핀테크 기업 LendingTree의 창립자이자 최고경영자 CEO 인 더그 렙다 Doug Lebda 씨가 55세의 나이에 핀테크 리더의 갑작스러운 부재가 남긴 슬픔처럼 모든 발전은 결국 사람을 향해야 한다는 점을 잊지 ,공감의 시작,blog.naver.com/begin_of_empathy,20251014
근로자 생활안정자금 대출 신청자격과 이용방법 총정리,https://sibauchi.tistory.com/1117,일부 핀테크 기업들은 기존 신용평가 모델의 한계를 극복하기 위해 새로운 대안 신용평가 시스템을 도입하여 대출 승인율을 높이는 전략을 취하고 있습니다 소비자들은 고금리 시대에 더욱 신중한 소비 습관을 ,Falconer's Teatime :: 이제는 말하고 말겠다-라멘토 비평,https://sibauchi.tistory.com/,20251014
25년 10월 14일 미증시 미 중 완화 기대와 JP모건 1 5조 달러 ,https://blog.naver.com/heavenrise/224040377180,45 중국 전기차 기업들 강세 암호화폐 핀테크 비트코인 미 중 갈등 완화 기대 속 금요일 급락 트럼프 관세 위협 바이낸스 오라클 오류 레버리지 청산 88 에 따른 되돌림 매수 유입 스트레티지 ,H E A V E N,blog.naver.com/heavenrise,20251014
 BNPL 선구매 후지급 카드의 시대를 흔들다 클라르나 ,https://blog.naver.com/danielryu2023/224035996139,장바구니증가 전자상거래 체크아웃UX 핀테크 개인금융 소비자보호 데이터거버넌스 크레딧리포트 금융리터러시 미국소비트렌드 분할결제 금융혁신 대안신용 비즈니스뉴스 다큐후기,시사/정치/사회문제 공부방,blog.naver.com/danielryu2023,20251014
흥미진진한 법 이야기 핀테크 탄핵 그리고 연애의 책임 ,https://blog.naver.com/ea38u7ej/224040373212,흥미진진한 법 이야기 핀테크 탄핵 그리고 연애의 책임 흥미진진한 법 이야기 핀테크 탄핵 그리고 연애의 책임 핀테크 법과 만나 혁신을 꽃피우다 미래를 여는 열쇠 핀테크 하지만 핀테크 뒤에는 반드시 ,ea38u7ej님의 블로그,blog.naver.com/ea38u7ej,20251014
현금서비스 리볼빙 상환방법과 이자 절감 팁 확인,https://think-tank.tistory.com/890,우려 핀테크의 성장 등 다양한 요인으로 인해 큰 변화를 겪었습니다 고금리 시대에 접어들면서 현금서비스와 리볼빙 이용 부담이 커졌고 소비자들은 더욱 신중하게 자금 관리를 하는 추세입니다 핀테크 ,think-tank.tistory.com,https://think-tank.tistory.com/,20251014
주택도시보증공사 전세금안심대출 조건과 신청절차 총정리,https://lefthusband.tistory.com/1540,주요 건설사들은 임대 주택 사업 확대를 통해 새로운 수익 모델을 창출하려 노력하고 있으며 핀테크 기업들은 전세 보증 보험 비교 플랫폼 등 혁신적인 서비스를 선보이며 시장 경쟁에 뛰어들고 있습니다 ,fgwaff,https://lefthusband.tistory.com/,20251014
2025 국내 IT주식 위메이드 52주 바닥권에서 이벤트 트리거 ,https://blog.naver.com/lucky-cat/224038682395,2 WEMIX 생태계 스테이블코인 추진 등 핀테크 결합으로 신사업 옵션 가치가 존재합니다 3 52주 범위 하단권에서 가격 방어력을 점검하며 이벤트 출시 토큰 메인넷 스포츠 스폰서십 연동 ,동네길냥이,blog.naver.com/lucky-cat,20251014
