title,link,description,bloggername,bloggerlink,postdate
루민트 생태계의 기업 협력 구조 신뢰를 산업으로 확장하다,https://blog.naver.com/kig6354/224042054702,금융기관과의 연계 일부 핀테크 기업들은 루민트의 블록체인을 투명한 자금 흐름 추적 용으로 도입할 준비를 마쳤다 5 물류 및 공급망 협력 루민트의 데이터 무결성 기능은 공급망 관리 기업들에게도 ,kig6354님의블로그,blog.naver.com/kig6354,20251015
스테이블코인 송금 3경원 시대 글로벌 결제 시장의 대격변 ,https://blog.naver.com/jksuccess25/224039755353,그러나 최근엔 스테이블코인을 비롯해 CBDC 중앙은행 디지털화폐 디지털 월렛 핀테크 기반 간편결제 한국에서도 일부 핀테크 업체들이 블록체인 기반 송금 서비스를 시범 운영 중이다 6 전통 금융사의 ,열심히말고찐하게꾸준히실행하자!!,blog.naver.com/jksuccess25,20251015
미국 나스닥이 비트코인에 영향을 주는 이유,https://blog.naver.com/klima249/224042046828,특히 클라우드 컴퓨팅 인공지능 핀테크 관련 기업들이 나스닥에서 두각을 나타낼 경우 비트코인에 대한 관심 역시 증가하는 추세를 보인다 이러한 상관관계를 통해 두 시장의 연결고리를 이해하고 이를 ,커다란 걸 위해,blog.naver.com/klima249,20251015
네이버 주가 지금 사도 괜찮을까요 ,https://blog.naver.com/walkaround-/224042045024,네이버 주가 3분기 실적 컨센서스 하회 전망에도 AI 핀테크 커머스 성장 스토리는 유효할까요 최근 바로 서치플랫폼 검색 광고 커머스 핀테크 콘텐츠 클라우드죠 우리가 매일 쓰는 네이버 검색과 ,리올파트너스와 함께하는 스마트한 투자 여정,blog.naver.com/walkaround-,20251015
 10월 15일 꿈밍이의 아침 브리핑,https://blog.naver.com/ggumlog/224042041788,기타 주목 종목 쿠콘 7 05 위츠 4 17 NHN KCP 4 19 핀테크 결제 테마 순환매 진행 중 쿠콘은 전자결제 데이터 연계 사업 수혜 NHN KCP는 PG업종 강세 영향 꿈밍이의 브리핑 오늘 시장은 전반적으로 ,꿈밍이의 경제 놀이터,blog.naver.com/ggumlog,20251015
스테이블 코인 뜻부터 ETF 투자 써클까지 다 알아봄,https://blog.naver.com/wemembers/224042038836,그래서 기관이나 핀테크 결제 등에 좀 더 활발하게 사용되고 있어요 따라서 스테이블 코인의 미래에 투자하고 싶다면 써클 기업을 공부해 보시는 것도 하나의 방법이구요 관련 ETF를 공부해 보는 것도 ,미쿡 아재의 경제 이야기,blog.naver.com/wemembers,20251015
피플펀드 대환대출 신청절차와 조건 알아보기,https://think-tank.tistory.com/887,하지만 정부의 정책 지원과 핀테크 기업들의 혁신적인 서비스 출시를 통해 새로운 기회가 창출될 수도 있습니다 주요 기업들은 금리 경쟁력을 확보하기 위해 노력하는 한편 빅데이터 분석을 통해 개인별 ,think-tank.tistory.com,https://think-tank.tistory.com/,20251015
루민트의 신뢰 기반 금융 모델 새로운 자산 구조의 실험,https://blog.naver.com/babygom1102/224042031236,기관 금융과의 연계 루민트는 일부 핀테크 기업들과 블록체인 신용평가 파일럿 프로젝트 를 추진 중이다 이는 전통 금융과 신뢰경제의 결합을 의미한다 9 상장 이후의 의미 루민트가 상장되면 이 ,babygom1102님의블로그,blog.naver.com/babygom1102,20251015
테더 USDT 란 코인시장의 안전지대 상상투자그룹과 함께 ,https://blog.naver.com/ssinvestment0512/224042030882,금융기관과의 협업 확대 일부 핀테크 기업과 은행은 테더를 달러 유동성 대체 수단으로 검토하고 있습니다 이는 디지털 금융 생태계가 기존 금융과 점차 융합되는 흐름을 보여줍니다 상상투자그룹의 시선 ,상상투자그룹,blog.naver.com/ssinvestment0512,20251015
2025년 주식 초보도 소액으로 시작하는 투자 방법 총정리,https://blog.naver.com/cbqtm1/224042030493,앱 기반 소액 투자 서비스 최근에는 증권사와 핀테크 앱에서 소액으로 주식을 사고팔 수 있는 서비스가 많습니다 예를 들어 1만 원 단위로 주식을 살 수 있어 투자 진입 장벽이 매우 낮아졌습니다 3 5 ,인생 레시피 일상 Life,blog.naver.com/cbqtm1,20251015
코나아이 디지털화폐 시대의 숨은 강자,https://blog.naver.com/hanminam388/224042026225,기업 개요 코나아이 KONA I 052400 는 스마트카드 및 디지털 결제 솔루션 전문기업으로 국내외 핀테크 확대 핀테크 플랫폼 코나카드 선불형 충전카드로 국내 다수 지자체의 지역화폐 운영 플랫폼으로 ,링코의 주식투자,blog.naver.com/hanminam388,20251015
 경제 금산분리  금융과 산업 어디까지 함께할 ,https://blog.naver.com/hyoline1987/224042023830,금산분리 완화 vs 강화 최근에는 빅테크 플랫폼 기업의 금융 진출 핀테크 산업의 성장으로 금산분리 재계 핀테크 기업 일부 정부 부처 기재부 금융위 시민단체 금융노조 일부 국회 및 학계 기대 효과 ,눈코입 그리고 귀,blog.naver.com/hyoline1987,20251015
신한카드 장기카드대출 신청조건과 상환방법 정리,https://think-tank.tistory.com/888,그리고 핀테크 기업의 약진이라는 삼중고를 겪었습니다 고금리 시대에 접어들면서 카드론 이용자들은 특히 토스 카카오페이 등 핀테크 플랫폼과의 제휴를 통해 젊은 고객층을 확보하려는 움직임이 ,think-tank.tistory.com,https://think-tank.tistory.com/,20251015
스테이블코인의 진화,https://blog.naver.com/skehlsek0103/224042019594,써클 USDC 규제 친화형 디지털 달러 써클 Circle 은 2013년 미국 매사추세츠주 보스턴에서 설립된 핀테크 기업이다 대표 스테이블코인인 USDC USD Coin 는 코인베이스 Coinbase 와 함께 발행 및 관리된다 ,사부아 비부르 삶을 꿈꾸다,blog.naver.com/skehlsek0103,20251015
루민트 상장 이후 금융 시장은 어떻게 반응할까,https://blog.naver.com/jskjs1119/224042020394,금융권의 관심 루민트는 상장 전임에도 국내외 자산운용사 핀테크 스타트업 일부 기관투자자들의 주목을 받고 있다 이유는 명확하다 기술적 안정성과 투명한 정보 공개 2 상장 후 초기 반응 예측 상장 ,깅탱경 님의 블로그,blog.naver.com/jskjs1119,20251015
리얼리뷰 사기 사칭 부업팀미션 속지 말아야 할 이유,https://blog.naver.com/mgreatmaild18/224042019913,이유 팀미션사기 주식사기 코인사기 스캠사기 사칭사기 공모주사기 투자사기 투자사기대응법 투자사기법적대응 사기피해회복 사기피해대응 사기피해전문변호사 핀테크전문 사기피해전문 ,daylaw,blog.naver.com/mgreatmaild18,20251015
루민트의 글로벌 기술 제휴 신뢰가 만든 연결망,https://blog.naver.com/barammii/224042018014,아시아권 협력 루민트는 한국 일본 싱가포르의 핀테크 기업과 협업 중이다 결제망 보안 시스템 암호화 데이터 관리 솔루션 등을 루민트의 블록체인 위에서 통합 테스트하고 있다 3 유럽 기술 기관과의 ,ㅇ,blog.naver.com/barammii,20251015
오브웰스 사기 TRENUE 금상장 거래 리딩방 정교한 유혹의 ,https://blog.naver.com/dissocition12385/224041890986, 사칭 팀미션사기 주식사기 코인사기 스캠사기 사칭사기 공모주사기 투자사기 투자사기대응법 투자사기법적대응 사기피해회복 사기피해대응 사기피해전문변호사 핀테크전문 사기피해전문 ,daylaw 강민성 대표 변호사,blog.naver.com/dissocition12385,20251015
우리금융지주주가그래프 금융개혁 논의가 오히려 주가에 ,https://blog.naver.com/sunkye0225/224041955511,소수의 시중은행이 시장을 과점하는 구조를 깨고 핀테크나 인터넷전문은행 같은 새로운 플레이어들이 더 활발하게 경쟁할 수 있는 환경을 만들겠다는 거예요 소비자로서는 선택의 폭이 넓어지고 더 좋은 ,데이터로 보는 돈,blog.naver.com/sunkye0225,20251015
10 15 암호화폐 크립토 USDC 축 모멘텀 유럽은 MiCA ,https://blog.naver.com/rockj3/224042009779,은행 핀테크 거대 상거래와의 파트너링이 수요의 내구성을 결정한다는 점에서 기관 리서치의 포커스는 타당해 보입니다 둘째 감독 일관성은 유럽에서 특히 중요합니다 국가별 감독 편차를 줄이는 ,부(富)의 길,blog.naver.com/rockj3,20251015
농협 햇살론뱅크 조건과 신청방법 후기 확인하기,https://sibauchi.tistory.com/1132,그리고 핀테크 기업의 경쟁 심화라는 복합적인 요인으로 인해 끊임없이 변화해왔습니다 특히 금리 인상은 대출 문턱을 높여 저신용 저소득층의 자금 접근성을 악화시키는 주요 원인이 되었습니다 핀테크 ,Falconer's Teatime :: 이제는 말하고 말겠다-라멘토 비평,https://sibauchi.tistory.com/,20251015
오브웰스 사기 TRENUE 금상장 거래 리딩방의 위험한 유혹 사칭 ,https://blog.naver.com/crnivorous20772/224041904297, 사칭 팀미션사기 주식사기 코인사기 스캠사기 사칭사기 공모주사기 투자사기 투자사기대응법 투자사기법적대응 사기피해회복 사기피해대응 사기피해전문변호사 핀테크전문 사기피해전문 ,데이 강민성 변호사,blog.naver.com/crnivorous20772,20251015
퍼플버블 사기 purplebubble 쇼핑몰 팀미션 부업의 함정 ,https://blog.naver.com/clevelnd42758/224041996021, 사칭 팀미션사기 주식사기 코인사기 스캠사기 사칭사기 공모주사기 투자사기 투자사기대응법 투자사기법적대응 사기피해회복 사기피해대응 사기피해전문변호사 핀테크전문 사기피해전문 ,clevelnd42758님의 블로그,blog.naver.com/clevelnd42758,20251015
금융의 미래 디지털 자산이 가져올 혁신 기회와 과제,https://blog.naver.com/miracle1024_/224040778473,KB금융그룹과 신한은행이 핀테크 스타트업과 협력해 새로운 금융 서비스를 개발하는 것처럼 대형 금융기관과 혁신 기업 간의 경쟁과 협력이 심화될 것입니다 또한 탈중앙화 금융 DeFi 과 중앙은행 디지털화폐 ,기업운영자금상담,blog.naver.com/miracle1024_,20251015
퍼플버블 사기 purplebubble 사칭 팀미션부업 이렇게 ,https://blog.naver.com/ltent87784/224041999531,대처하세요 팀미션사기 주식사기 코인사기 스캠사기 사칭사기 공모주사기 투자사기 투자사기대응법 투자사기법적대응 사기피해회복 사기피해대응 사기피해전문변호사 핀테크전문 ,daylaw 강민성 대표 변호사,blog.naver.com/ltent87784,20251015
BDC 주식 관련주 테마주 대장주 수혜주 정리,https://blog.naver.com/aselstan/224041999273,현대차 현대차증권 현대캐피탈 등 계열사를 통해 모빌리티 분야 스타트업 투자 및 핀테크 지원에 컴퍼니케이 벤처캐피탈 VC 사로 AI 바이오 핀테크 등 혁신 기술 기업에 집중 투자합니다 ,아셀,blog.naver.com/aselstan,20251015
클라우드 뱅킹이란 미래 금융의 핵심 트렌드,https://blog.naver.com/shs040404/224041997745,초연결 금융 생태계 핀테크 기업 보험사 유통사 등이 하나의 클라우드 플랫폼 안에서 연결되어 은행뿐 아니라 핀테크 보험 투자 플랫폼까지 모두 클라우드 중심으로 재편되고 있으며 이는 결국 더 ,지훈맘의 일상에서의 다양한 정보 이야기,blog.naver.com/shs040404,20251015
빅데이터 시대 국비지원으로 데이터 분석가의 길을 열다,https://blog.naver.com/kkdh0083/224041996046,핀테크와 금융 시장 은행 카드사 보험사에서는 고객의 소비 패턴과 신용도를 분석해 맞춤형 금융 상품을 개발합니다 사기 거래 탐지 투자 예측 리스크 관리 등에서 데이터분석은 필수적인 도구가 ,IT Career Guide: 준비부터 성공까지,blog.naver.com/kkdh0083,20251015
루나 이후 3년 한국이 다시 약속을 쓴다 스테이블코인 ,https://blog.naver.com/make_second_salary/224041990912,은행 중심 발행만 허용하면 시장 경쟁이 막히고 핀테크 기업의 성장 기회가 사라진다고 본다 두 결제 핀테크 인프라 보유 카카오뱅크 페이 연계 결제망 확대 수혜 비덴트 업비트 최대주주 ,재테크요원의 Second Salary HQ,blog.naver.com/make_second_salary,20251015
2 카카오뱅크,https://blog.naver.com/hero1197/224041981318,카카오뱅크 시작하며 디지털 은행의 가능성 그 핵심 주자 핀테크 디지털 뱅킹 바람 속에서 카카오뱅크 KakaoBank 디지털뱅크 인터넷전문은행 핀테크 모바일뱅킹 금융플랫폼 카카오 디지털금융 ,IM DABABA 컨설팅,blog.naver.com/hero1197,20251015
다날 주가 분석 및 향후 전망 투자 전략 가이드,https://blog.naver.com/gaogaiga13/224041058636,디지털 금융과 핀테크 시장이 성장하는 가운데 안정적인 수익 구조와 다양한 신사업 진출로 글로벌 핀테크 트렌드 호재와 함께 투자자 관심이 집중되었습니다 다만 2025년 상반기에는 경기 변동과 국내외 ,3년1억,blog.naver.com/gaogaiga13,20251015
리플 XRP 은행형 블록체인,https://blog.naver.com/skehlsek0103/224041978696,리플은 단순히 코인을 파는 회사가 아니라 금융 인프라를 판매하는 B2B 핀테크 기업이야 정확히 리플은 단순히 코인을 파는 회사가 아니라 금융 인프라를 판매하는 B2B 핀테크 기업이야 정확히 ,사부아 비부르 삶을 꿈꾸다,blog.naver.com/skehlsek0103,20251015
카카오뱅크 비상금대출 연체 후 대처방법 확인,https://sibauchi.tistory.com/1146,또한 핀테크 기업들은 금리 인상에 대응하여 리스크 관리 시스템을 강화하고 다양한 상환 방식을 제공하는 등 적극적인 전략을 펼칠 것으로 보입니다 소비자들은 고금리 시대에 맞춰 소비 습관을 재점검하고 ,Falconer's Teatime :: 이제는 말하고 말겠다-라멘토 비평,https://sibauchi.tistory.com/,20251015
퍼플버블 사기 쇼핑몰 팀미션 부업 믿음으로 유도된 ,https://blog.naver.com/frngible82663/224041963463, 사칭 팀미션사기 주식사기 코인사기 스캠사기 사칭사기 공모주사기 투자사기 투자사기대응법 투자사기법적대응 사기피해회복 사기피해대응 사기피해전문변호사 핀테크전문 사기피해전문 ,daylaw 강민성 대표 변호사,blog.naver.com/frngible82663,20251015
2025년 10월 15일 16일 미국주식정보 25 10 15 ,https://blog.naver.com/wnguddhkd/224041961763,첨부파일 10 15 미국 트럼프 중국에 대두 수입 중단 경고 연준 파월 의장은 양적긴축 종료 시사 등 pdf 첨부파일 TDAGeneric NAM 10152025 pdf ASML BAC DLTR KARO EQBK HWC MS PGR SYF ABT PLD CFG FHN PNC ,호기심,blog.naver.com/wnguddhkd,20251015
 quot 10초 이체 카카오뱅크 vs 10분 로딩 은행 앱 이 차이는 ,https://blog.naver.com/opopjknm/224041958862, quot 아 진짜 로그인만 5분째네 quot quot 공인인증서 비번 뭐였지 보안카드 어디 갔어 quot 여러분 은행 앱 한번 쓰려다가 혈압 올라서 뒷목 잡았던 경험 다들 있으시죠 분명 내 돈 내가 쓰겠다는데 온갖 인증 절차와 ,오늘의 트렌드픽,blog.naver.com/opopjknm,20251015
전북은행 비상금대출 신청자격과 한도조건 정리,https://sibauchi.tistory.com/1092,핀테크 기업들의 공격적인 마케팅과 간편한 대출 서비스는 전통적인 은행의 경쟁력을 위협하며 시장의 주요 은행들은 디지털 전환을 가속화하고 핀테크 기업과의 협력을 통해 새로운 고객 확보 전략을 ,Falconer's Teatime :: 이제는 말하고 말겠다-라멘토 비평,https://sibauchi.tistory.com/,20251015
와타나베 부인 미국주식으로 우아한 할머니 되기,https://blog.naver.com/33mom_invest/224041954018,AI 반도체 빅테크 핀테크 블록체인 혁신기술 양자컴퓨터 정책이 곧 돈의 방향이다 누가 잘 될까보다 어디에 돈이 몰리는가를 봐야 한다 ETF로 분산투자하자 ETF는 여러 종목이 담긴 바구니다 ,개미아줌마 투자기록장,blog.naver.com/33mom_invest,20251015
리얼리뷰 사기 사칭 팀미션 피해회복 이것만은 꼭 알아두세요,https://blog.naver.com/emsculte79299/224041947818,알아두세요 팀미션사기 주식사기 코인사기 스캠사기 사칭사기 공모주사기 투자사기 투자사기대응법 투자사기법적대응 사기피해회복 사기피해대응 사기피해전문변호사 핀테크전문 사기피해전문 ,daylaw 강민성 대표 변호사,blog.naver.com/emsculte79299,20251015
8등급 대출 재대출 가능한 조건과 승인사례 공유,https://sibauchi.tistory.com/1135,반면 핀테크 기업들은 빅데이터 기반의 신용평가 모델을 도입하여 틈새시장을 공략하고 있으며 대출 전문가들은 정부의 적극적인 금융 지원 정책과 함께 핀테크 기업들의 혁신적인 신용평가 모델 도입이 ,Falconer's Teatime :: 이제는 말하고 말겠다-라멘토 비평,https://sibauchi.tistory.com/,20251015
국내외 양자컴퓨터 관련주 실적 및 기술 보유 현황,https://blog.naver.com/ohroseshop/224041946031,ID Quantique 납품 사례 있음 최근 양자 테마주로 묶이며 일부 주가 급등 있음 아톤 핀테크 인증 보안 양자내성 암호 ML DSA 기술 적용 인증솔루션 개발 발표됨 양자 보안 테마주로 상승세 보임 우리로 ,bom의 블로그,blog.naver.com/ohroseshop,20251015
지금 바로 5만 원 받기 케이뱅크 송편 뽑기 정답 총정리 10월 ,https://blog.naver.com/rlaqudcjf338/224041944677,2025년 모바일 뱅킹 트렌드 분석 디지털 금융 시장 변화 올해 핀테크 업계는 고객 확보를 위한 경쟁이 더욱 치열해졌습니다 카카오뱅크 토스 뱅크 케이뱅크 등 주요 인터넷 전문 은행들이 다양한 마케팅 ,소확행,blog.naver.com/rlaqudcjf338,20251015
대학생 대출 신청조건과 금리 비교 총정리,https://think-tank.tistory.com/885,핀테크 기업의 등장으로 인해 대출 상품이 더욱 다양해지고 대출 신청 절차가 더욱 간편해질 것입니다 또한 인공지능 AI 을 활용한 대출 심사 시스템이 도입되어 대출 심사의 정확성이 높아질 것입니다 ,think-tank.tistory.com,https://think-tank.tistory.com/,20251015
미래 지향적 주식 투자 추천 믿거나 말거나,https://blog.naver.com/eyhs80/224041939801, 5 데이터 핀테크 디지털 자산 핵심 이유 블록체인 기반 결제 자산 토큰화 AI금융이 새로운 금융질서로 이동 관련 주식 Coinbase Block Square PayPal Palantir https link coupang ,정보는 본느 좋은 정보,blog.naver.com/eyhs80,20251015
장기카드대출 빨리 철회하고 신용점수 올리기 NICE KCB ,https://blog.naver.com/blenakorea/224041936463,또한 별도의 서류 제출 없이 핀테크 앱 네이버페이 토스 등 을 통해 간편하게 납부내역을 제출할 수 있으니 적극 활용하시길 권장합니다 3 카드대금 선결제 결제일 전에 미리 납부하는 선결제는 신용점수 ,이룸금융센터 Partner밥팀장,blog.naver.com/blenakorea,20251015
신한 쏠편한 비상금대출 신청 절차와 실제 이용 후기,https://sibauchi.tistory.com/1112,강화 핀테크 기업의 적극적인 참여 등 다양한 요인으로 인해 역동적인 변화를 겪었습니다 특히 금리 인상은 소비자들의 대출 부담을 가중시켰고 정부의 대출 규제는 대출 문턱을 높였습니다 반면 핀테크 ,Falconer's Teatime :: 이제는 말하고 말겠다-라멘토 비평,https://sibauchi.tistory.com/,20251015
마이데이터 사업자라면 꼭 알아야 할 법률 적용 기준,https://blog.naver.com/byunbyun_law/224041919942, 마이데이터 MyData 개인정보보호법 신용정보법 개인정보위원회 특수전문기관 일반전문기관 데이터전송요구권 데이터활용 데이터산업 핀테크 데이터법제 정보보호 데이터정책 마이데이터사업자 ,최변과 변변의 법률 서재,blog.naver.com/byunbyun_law,20251015
성남채무자신용조사 변호사 상담 전 확인해야 할 체크리스트,https://blog.naver.com/appropriate5g/224041919785,예를 들어 한 핀테크 기업이 성남채무자신용조사에 AI를 적용해서 고객의 재무 상태를 실시간으로 분석하는 서비스로 경쟁력을 강화하고 있습니다 이 경우 요청자는 간편하게 신용 조사를 받을 수 있고 ,은하수여행,blog.naver.com/appropriate5g,20251015
 네 카 토 지분 쥔 증권사들 스테이블코인 수혜 ,https://blog.naver.com/bamnatowl/224041919964,그런데 이 세 핀테크 플랫폼 기업들의 지분을 보유한 증권사들이 주목받고 있다는 사실 알고 23 보유 이처럼 국내 대표 증권사들이 네 카 토 핀테크 계열사에 상당한 지분을 가지고 있습니다 ,헤베다,blog.naver.com/bamnatowl,20251015
근로장려금 수급자를 위한 맞춤형 대출 종류 총정리,https://think-tank.tistory.com/907,강화 핀테크 기업의 등장 등 다양한 요인으로 인해 빠르게 변화하고 있습니다 특히 저금리 시대가 또한 핀테크 기업들은 빅데이터 분석과 AI 기술을 활용하여 개인별 맞춤형 대출 상품을 추천하고 온라인 ,think-tank.tistory.com,https://think-tank.tistory.com/,20251015
똑똑한 해외송금 지머니트랜스 파헤치기 수수료 절약 노하우,https://blog.naver.com/mm_yooni/224041912905,지머니트랜스는 금융위원회에 정식 등록된 합법적인 해외송금 핀테크 기업으로 고객 자금을 회사 해외송금 지머니트랜스 송금수수료 해외송금꿀팁 핀테크 환율 자산관리 유학생송금 해외생활비 ,브랜드메이커 유니,blog.naver.com/mm_yooni,20251015
루민트 금융 산업의 신뢰를 재정의하는 블록체인 데이터 인프라,https://blog.naver.com/mecca_edu_/224041909451,금융 데이터 거버넌스 혁신 루민트는 금융기관 간 데이터 연동 플랫폼을 통해 은행 보험 핀테크 간 데이터 공유의 효율성을 높이고 있습니다 중앙 관리 없이도 신뢰를 유지할 수 있는 분산형 구조가 금융 ,km님의 블로그,blog.naver.com/mecca_edu_,20251015
리드코프 주부대출 신청조건과 재대출 가능여부 확인,https://sibauchi.tistory.com/1128,강화 핀테크 기업의 등장 등 다양한 요인에 의해 끊임없이 변화해왔습니다 특히 금리 인상은 대출 상환 부담을 가중시켜 신규 대출 신청을 망설이게 하는 요인으로 작용했습니다 동시에 핀테크 기업들은 ,Falconer's Teatime :: 이제는 말하고 말겠다-라멘토 비평,https://sibauchi.tistory.com/,20251015
개인파산 P2P대출 처리 어떻게 해야 할까 ,https://blog.naver.com/weather4092/224041904262,최근 몇 년간 핀테크 기술 발전하면서 P2P 대출 산업도 빠르게 성장하였습니다 그러나 경기 침체나 재정 문제로 인해 대출 상환이 어려워진 경우에는 개인 파산을 고려해야 할 수도 있는데요 이때 P2P 대출을 ,부자 되는 습관,blog.naver.com/weather4092,20251015
 아티클 10월 셋째 주 2030 투자 트렌드 콩알금 에서 ,https://blog.naver.com/hyns_blog/224041897717,핀테크의 무기 소수점 자동 구독형 2030세대는 수입과 지출이 일정하지 않기에 조금씩 자주 증권사는 1주보다 작은 단위로 주식을 살 수 있는 소수점 투자 은행 핀테크는 라운드업 잔돈 투자 ,실무자의 시간을 아껴줄 : BUSINESS STUDY LOUNGE,blog.naver.com/hyns_blog,20251015
웰컴저축은행 자동대출 신청자격과 이용절차 안내,https://think-tank.tistory.com/912,강화 핀테크 기업의 성장 등 다양한 요인에 의해 큰 변화를 겪었습니다 특히 고금리 시대에 핀테크 기업들은 인공지능 AI 기반의 신용 평가 모델을 도입하여 리스크 관리를 강화하고 맞춤형 대출 상품을 ,think-tank.tistory.com,https://think-tank.tistory.com/,20251015
양자컴퓨터 관련주 완벽 정리,https://blog.naver.com/ohroseshop/224041895869,아톤 핀테크 보안 솔루션 양자 보안 결제 인증 연구 금융권 양자보안 적용 기대 우리넷 네트워크 장비 양자암호 기반 네트워크 실증 사업 참여 공공기관 연계 사업 강점 요약 국내 기업들은 ,bom의 블로그,blog.naver.com/ohroseshop,20251015
루민트의 글로벌 전략 상장을 넘어 세계로,https://blog.naver.com/call1128/224041893901,파트너십 확대 현재 루민트는 유럽 일본 동남아 등지의 핀테크 기업들과 기술 제휴 협상을 진행 중입니다 이는 상장 이후 사용성 확장 을 위한 포석입니다 6 글로벌 신뢰 구축 루민트는 프로젝트 ,call1128님의 블로그,blog.naver.com/call1128,20251015
