title,link,description,bloggername,bloggerlink,postdate
달러와 1 대 1 연동인데 테더 1500원대 이상 급등 ,https://blog.naver.com/oiiiii542/224041409515,페그이탈 금융시장 암호화폐시장 규제개선 투자경고 벤치마크가격 디지털자산 가상자산 국제정세 투기적수요 핀테크 기사 출처 링크 https n news naver com article newspaper 015 0005196035 date 20251014,뉴스크래핑,blog.naver.com/oiiiii542,20251014
MarketBRIDGE 사기 마켓브릿지 팀미션 부업 의 실체 사칭 ,https://blog.naver.com/discernment30649/224041055707, 사칭 팀미션사기 주식사기 코인사기 스캠사기 사칭사기 공모주사기 투자사기 투자사기대응법 투자사기법적대응 사기피해회복 사기피해대응 사기피해전문변호사 핀테크전문 사기피해전문 ,daylaw 강민성 대표 변호사,blog.naver.com/discernment30649,20251014
MarketBRIDGE 사기 팀미션부업 믿었다가 낭패 볼수 있다 ,https://blog.naver.com/ntinomy28824/224041220617, 사칭 팀미션사기 주식사기 코인사기 스캠사기 사칭사기 공모주사기 투자사기 투자사기대응법 투자사기법적대응 사기피해회복 사기피해대응 사기피해전문변호사 핀테크전문 사기피해전문 ,데이 강민성 변호사,blog.naver.com/ntinomy28824,20251014
앤픽몰 사기 쇼핑몰 팀미션 일자리로 위장한 확산을 막는 방법 ,https://blog.naver.com/clevelnd42758/224040907386, 사칭 팀미션사기 주식사기 코인사기 스캠사기 사칭사기 공모주사기 투자사기 투자사기대응법 투자사기법적대응 사기피해회복 사기피해대응 사기피해전문변호사 핀테크전문 사기피해전문 ,clevelnd42758님의 블로그,blog.naver.com/clevelnd42758,20251014
앤픽몰 사기 사칭 쇼핑몰 부업이라 속은 뒤 남은 건 후회뿐이었다,https://blog.naver.com/resilient77515/224040936697,후회뿐이었다 팀미션사기 주식사기 코인사기 스캠사기 사칭사기 공모주사기 투자사기 투자사기대응법 투자사기법적대응 사기피해회복 사기피해대응 사기피해전문변호사 핀테크전문 사기피해전문 ,데이 강민성 변호사,blog.naver.com/resilient77515,20251014
스테이블 코인앱,https://blog.naver.com/medosam/224041398526,RedotPay 홍콩 기반 핀테크 기업이 개발한 암호화폐 결제 플랫폼으로 Visa 카드를 통해 전 세계 어디서나 실시간 결제를 지원합니다 USDC USDT BTC ETH 등 다양한 암호화폐를 지원하며 ATM 출금 및 ,4차산업혁명,blog.naver.com/medosam,20251014
Bullbit 사기 볼비트 사칭 하이퍼AI 투자 절대 조심해야 합니다,https://blog.naver.com/ickkoju2/224041338719,합니다 팀미션사기 주식사기 코인사기 스캠사기 사칭사기 공모주사기 투자사기 투자사기대응법 투자사기법적대응 사기피해회복 사기피해대응 사기피해전문변호사 핀테크전문 사기피해전문 ,데이법률사무소,blog.naver.com/ickkoju2,20251014
프렌드샵 사기 사칭 팀미션 부업이라 속아 잃은 삶의 균형,https://blog.naver.com/floorcloth85513/224040996956,균형 팀미션사기 주식사기 코인사기 스캠사기 사칭사기 공모주사기 투자사기 투자사기대응법 투자사기법적대응 사기피해회복 사기피해대응 사기피해전문변호사 핀테크전문 사기피해전문 ,데이 강민성 변호사,blog.naver.com/floorcloth85513,20251014
아트컨티뉴 사기 사칭 미술품 폰지 유사수신 채권 피해 ,https://blog.naver.com/mgreatmaild18/224041128842,주의하세요 팀미션사기 주식사기 코인사기 스캠사기 사칭사기 공모주사기 투자사기 투자사기대응법 투자사기법적대응 사기피해회복 사기피해대응 사기피해전문변호사 핀테크전문 사기피해전문 ,daylaw,blog.naver.com/mgreatmaild18,20251014
리사블룸 사기 lsabbact 팀미션 추가금 요구 출금 차단 분석 ,https://blog.naver.com/crnivorous20772/224040846015, 사칭 팀미션사기 주식사기 코인사기 스캠사기 사칭사기 공모주사기 투자사기 투자사기대응법 투자사기법적대응 사기피해회복 사기피해대응 사기피해전문변호사 핀테크전문 사기피해전문 ,데이 강민성 변호사,blog.naver.com/crnivorous20772,20251014
프렌드샵 사기 팀미션 부업을 빙자한 금전 갈취 주의 사칭 ,https://blog.naver.com/instlltion64901/224040993524, 사칭 팀미션사기 주식사기 코인사기 스캠사기 사칭사기 공모주사기 투자사기 투자사기대응법 투자사기법적대응 사기피해회복 사기피해대응 사기피해전문변호사 핀테크전문 사기피해전문 ,daylaw 강민성 대표 변호사,blog.naver.com/instlltion64901,20251014
24시간 모바일 대출 프리랜서도 가능할까 성공적인 활용법,https://blog.naver.com/1spoon610/224041392381,일부 핀테크 업체는 낮은 금리를 제시하지만 보증 보험료 플랫폼 이용 수수료 등 추가 비용이 발생할 수 있습니다 따라서 대출 실행 총비용 계산서 를 꼼꼼히 확인하고 중도상환 수수료 연체 이자율 등 세부 ,경제한스푼,blog.naver.com/1spoon610,20251014
 루틴 10 14 뉴스 헤드라인S,https://blog.naver.com/tjsw103/224041391899,스테이블코인 핀테크 BVNK 인수 협상 노보 노디스크 세포치료 부문 폐쇄 트럼프 중국으로의 보잉 부품 수출 제한할 가능성 언급 블록 XYZ BNPL 서비스 중요한 성장동력 될 전망 UBS xyz 퀄컴 QCOM ,올바른 결정과 실행,blog.naver.com/tjsw103,20251014
프렌드샵 사기 팀미션 부업의 실체와 피해 대응 가이드 사칭 ,https://blog.naver.com/convulse87018/224041001851, 사칭 팀미션사기 주식사기 코인사기 스캠사기 사칭사기 공모주사기 투자사기 투자사기대응법 투자사기법적대응 사기피해회복 사기피해대응 사기피해전문변호사 핀테크전문 사기피해전문 ,daylaw 강민성 대표 변호사,blog.naver.com/convulse87018,20251014
vks파트너스 사기 사칭 투자리딩방 어떻게 대처할까,https://blog.naver.com/dgzuxzgby/224041270389,대처할까 팀미션사기 주식사기 코인사기 스캠사기 사칭사기 공모주사기 투자사기 투자사기대응법 투자사기법적대응 사기피해회복 사기피해대응 사기피해전문변호사 핀테크전문 사기피해전문 ,데이법률사무소,blog.naver.com/dgzuxzgby,20251014
MarketBRIDGE 사기 마켓브릿지 사칭 부업 미션이라 속고 전 ,https://blog.naver.com/devition26866/224041045646,잃었다 팀미션사기 주식사기 코인사기 스캠사기 사칭사기 공모주사기 투자사기 투자사기대응법 투자사기법적대응 사기피해회복 사기피해대응 사기피해전문변호사 핀테크전문 사기피해전문 ,데이 강민성 변호사,blog.naver.com/devition26866,20251014
LUST클럽 사기 로맨스스캠 투자 이대로 당할 수 없습니다 사칭 ,https://blog.naver.com/ntinomy28824/224041215505, 사칭 팀미션사기 주식사기 코인사기 스캠사기 사칭사기 공모주사기 투자사기 투자사기대응법 투자사기법적대응 사기피해회복 사기피해대응 사기피해전문변호사 핀테크전문 사기피해전문 ,데이 강민성 변호사,blog.naver.com/ntinomy28824,20251014
VKS파트너스 사기 투자 리딩방 조심하세요 사칭 ,https://blog.naver.com/sleigh47200/224041187735, 사칭 팀미션사기 주식사기 코인사기 스캠사기 사칭사기 공모주사기 투자사기 투자사기대응법 투자사기법적대응 사기피해회복 사기피해대응 사기피해전문변호사 핀테크전문 사기피해전문 ,데이 강민성 변호사,blog.naver.com/sleigh47200,20251014
 아티클 10월 셋째 주 네이버 두나무 단순한 M amp A가 아닌 ,https://blog.naver.com/hyns_blog/224041352407,AI 핀테크 수직계열화 모델을 완성하게 됩니다 두나무의 의도 가상자산을 제도권으로 그러나 이번 거래는 단순히 네이버의 신사업 확장이 아니라 한국 디지털 경제의 AI 핀테크 블록체인 융합 ,실무자의 시간을 아껴줄 : BUSINESS STUDY LOUNGE,blog.naver.com/hyns_blog,20251014
앤픽몰 사기 쇼핑몰 팀미션의 정체와 피해 예방 방법 사칭 ,https://blog.naver.com/frngible82663/224040906322, 사칭 팀미션사기 주식사기 코인사기 스캠사기 사칭사기 공모주사기 투자사기 투자사기대응법 투자사기법적대응 사기피해회복 사기피해대응 사기피해전문변호사 핀테크전문 사기피해전문 ,daylaw 강민성 대표 변호사,blog.naver.com/frngible82663,20251014
기관 외인 2차전지에 미쳤다 수급 포착 종목 TOP5 종목쇼 ,https://blog.naver.com/hitakuchi/224041345599, 핀테크 결제 코나아이 052400 지역화폐 플랫폼 기반 매출 안정 정책 변화 민감도 높음 쿠콘 294570 API 데이터 결제 연결 확장 특정 고객 의존도 점검 NHN한국사이버결제 060250 온 오프 ,영덕제일약국,blog.naver.com/hitakuchi,20251014
2025 10 08 2025 10 14 인공지능 AI 소식 정리 ,https://minimalist-thought.tistory.com/164,핀테크 계열사 앤트 그룹은 1조 개 매개변수의 오픈소스 LLM인 링 1T Ling 1T 를 공개하며 실용적인 AGI 서비스 구축을 목표로 한다고 밝혔습니다 기타 글로벌 기업 및 국가 동향 소프트뱅크 는 스위스 ,오늘출근오늘퇴근 - 오늘출근오늘퇴근,https://minimalist-thought.tistory.com/,20251014
 lt 다날 gt 에 대해 알아보자,https://blog.naver.com/promd416/224041341041, 이 경우 다날은 핀테크 성장주 재평가 받을 수 있음 4 현실 가능성 평가 5 결론 요약 스테이블코인 사업은 다날의 체질을 바꿀 수 있는 유일한 성장축이지만 단독 진출 은 ,영혼을 갈아 넣어라,blog.naver.com/promd416,20251014
10월 14일 시간외 상한가 없음 시간외 특징주 스테이블코인 ,https://blog.naver.com/leegg209/224041337562, 더즌 스테이블코인 관련주 B2B 핀테크 토탈 플랫폼 기업 원화 스테이블코인 수혜 잠재력 마이크로투나노 HBM4 관련주 HBM4용 프로브카드 수주 가능성 낸드 신규 수주 지속 다양한 제품군으로 ,월천개미,blog.naver.com/leegg209,20251014
더나은투자 사기 사칭 리딩방 절대 피해야 할 핵심포인트,https://blog.naver.com/mgreatmaild18/224041123359,핵심포인트 팀미션사기 주식사기 코인사기 스캠사기 사칭사기 공모주사기 투자사기 투자사기대응법 투자사기법적대응 사기피해회복 사기피해대응 사기피해전문변호사 핀테크전문 사기피해전문 ,daylaw,blog.naver.com/mgreatmaild18,20251014
vks파트너스 사기 사칭 투자리딩이라 믿은 순간 파국이 시작됐다,https://blog.naver.com/floorcloth85513/224040988269,시작됐다 팀미션사기 주식사기 코인사기 스캠사기 사칭사기 공모주사기 투자사기 투자사기대응법 투자사기법적대응 사기피해회복 사기피해대응 사기피해전문변호사 핀테크전문 사기피해전문 ,데이 강민성 변호사,blog.naver.com/floorcloth85513,20251014
네이버 조정 막바지 24 6만 하방 이탈 vs 국감 모멘텀,https://blog.naver.com/moon74_/224041335424,국내 관건 국감 포인트 민간 빅테크 핀테크 발행 허용 범위 준비금 상환 감독 체계 외화 원화 페깅 규칙 긍정적 가닥 시 심리 개선 관련주 플랫폼 결제 보안 변동성 확대 가능 3 두나무 업비트 ,문선생 경제교실,blog.naver.com/moon74_,20251014
VOILIVE 사기 사칭 부업알바 절대 믿으시면 안됩니다,https://blog.naver.com/ickkoju2/224041333757,안됩니다 팀미션사기 주식사기 코인사기 스캠사기 사칭사기 공모주사기 투자사기 투자사기대응법 투자사기법적대응 사기피해회복 사기피해대응 사기피해전문변호사 핀테크전문 사기피해전문 ,데이법률사무소,blog.naver.com/ickkoju2,20251014
카카오페이 심리적 지지선 테스트 국감 스테이블코인 ,https://blog.naver.com/moon74_/224041332597,국내 관건 민간 발행 허용 범위 핀테크 빅테크 포함 준거자산 준칙 현금 국채 현금성자산 등 1 1 타임라인 핀테크 규제 결제 파트너십 스테이블코인 해외송금 관련 차트 신호 박스 하단 이탈 ,문선생 경제교실,blog.naver.com/moon74_,20251014
가상자산 인공지능에 주목하라,https://blog.naver.com/kki02077/224041332153,미래에는 핀테크 가상자산 인공지능이 바꿀 디지털 금융에 관심을 가져야 할것이다 인공지능과 가상자산 핀테크 산업내 질서가 디지털 플랫폼 을 중심으로 바뀌어 가고 있으며 금융산업 에서도 이러한 ,"월천만(""경제적 자유"" 함께 이루어요)",blog.naver.com/kki02077,20251014
리사블룸 사기 lsabbact 사칭 팀미션 수법의 함정,https://blog.naver.com/mgreatmaild18/224041118000,함정 팀미션사기 주식사기 코인사기 스캠사기 사칭사기 공모주사기 투자사기 투자사기대응법 투자사기법적대응 사기피해회복 사기피해대응 사기피해전문변호사 핀테크전문 사기피해전문 ,daylaw,blog.naver.com/mgreatmaild18,20251014
K535 사기 사칭 주식리딩방 절대 믿지마세요,https://blog.naver.com/dgzuxzgby/224041265419,믿지마세요 팀미션사기 주식사기 코인사기 스캠사기 사칭사기 공모주사기 투자사기 투자사기대응법 투자사기법적대응 사기피해회복 사기피해대응 사기피해전문변호사 핀테크전문 사기피해전문 ,데이법률사무소,blog.naver.com/dgzuxzgby,20251014
LUST클럽 사기 사칭 로맨스로 접근해 투자까지 빼앗은 정교한 ,https://blog.naver.com/devition26866/224041041151,수법 팀미션사기 주식사기 코인사기 스캠사기 사칭사기 공모주사기 투자사기 투자사기대응법 투자사기법적대응 사기피해회복 사기피해대응 사기피해전문변호사 핀테크전문 사기피해전문 ,데이 강민성 변호사,blog.naver.com/devition26866,20251014
양도가능 신용장의 숨겨진 리스크 수익자 변경 시 반드시 ,https://blog.naver.com/legal_lemonade/224041327107,About the Authour 국내 대형은행 법무팀에서 10년 이상 국제금융 신용장 영문계약서 및 외국환규제 자문 등을 담당하고 핀테크 기업에서 해외 지급결제와 해외 진출 등 다양한 프로젝트를 수행한 ,리걸 레몬에이드,blog.naver.com/legal_lemonade,20251014
3분기 평탄 실적 네이버 카카오 4분기부터 상승곡선 ,https://blog.naver.com/coxnews/224041323491,스테이블코인 제도화 시에도 네이버와 카카오가 국민과의 접점과 핀테크 역량을 바탕으로 유통 경쟁력을 갖춘 플랫폼으로 평가받을 전망이다 김영수 기자 coxnews co kr 출처 콕스뉴스 https www ,세상을 바라보는 키잡이 언론 콕스뉴스(COXNEWS),blog.naver.com/coxnews,20251014
hvcvsz com 사기 사칭 출금지연 조심해야 합니다,https://blog.naver.com/dgzuxzgby/224041260226,합니다 팀미션사기 주식사기 코인사기 스캠사기 사칭사기 공모주사기 투자사기 투자사기대응법 투자사기법적대응 사기피해회복 사기피해대응 사기피해전문변호사 핀테크전문 사기피해전문 ,데이법률사무소,blog.naver.com/dgzuxzgby,20251014
다날 써클과 온보딩 완료 한국 유일 스테이블코인 파트너의 ,https://blog.naver.com/yonadan4/224041316833,즉 전통 금융과 디지털 자산을 잇는 하이브리드 핀테크 기업 으로 진화 중입니다 올해 안에 마스터카드결제 핀테크혁신 디지털자산법 스테이블코인법제화 국정감사이슈 김상훈위원장 ,인블장과 함께 인플루언서로 블로그 장인 되기!,blog.naver.com/yonadan4,20251014
원달러 환율이 1 400원대인데 달러 기반 스테이블 코인이 만 ,https://blog.naver.com/ahdtlf715/224041313437,국내에서도 일부 핀테크 기업들이 원화 기반 스테이블코인을 준비 중이지만 통화 주권과 금융 안정성 문제를 고려해야 한다는 지적이 함께 제기되고 있습니다 안정성 은 시장의 균형이 지켜질 때만 가능 ,두리의 취향 저장소,blog.naver.com/ahdtlf715,20251014
리사블룸 사기 lsabbact 사칭 정상기업이라 믿은 팀미션의 함정,https://blog.naver.com/unicellulr54589/224040868626,함정 팀미션사기 주식사기 코인사기 스캠사기 사칭사기 공모주사기 투자사기 투자사기대응법 투자사기법적대응 사기피해회복 사기피해대응 사기피해전문변호사 핀테크전문 사기피해전문 ,데이 강민성 변호사,blog.naver.com/unicellulr54589,20251014
 2025 10 14 화 오늘의 정책 시그널 요약,https://blog.naver.com/policyintel/224041301327, 날짜 2025 10 14 관련주 콜마비앤에이치 핀테크 암호화폐 섹터 Top 이슈        2023년 10월 영국 금융행위감독청 FCA 은 약 19조 달러 규모의 자산 ,policy Intel,blog.naver.com/policyintel,20251014
xauusd 사기 금거래 미끼 이렇게 접근합니다 사칭 ,https://blog.naver.com/ntinomy28824/224041211436, 사칭 팀미션사기 주식사기 코인사기 스캠사기 사칭사기 공모주사기 투자사기 투자사기대응법 투자사기법적대응 사기피해회복 사기피해대응 사기피해전문변호사 핀테크전문 사기피해전문 ,데이 강민성 변호사,blog.naver.com/ntinomy28824,20251014
K535 사기 주식 리딩방 주의 피해 확산 중입니다 사칭 ,https://blog.naver.com/sleigh47200/224041181023, 사칭 팀미션사기 주식사기 코인사기 스캠사기 사칭사기 공모주사기 투자사기 투자사기대응법 투자사기법적대응 사기피해회복 사기피해대응 사기피해전문변호사 핀테크전문 사기피해전문 ,데이 강민성 변호사,blog.naver.com/sleigh47200,20251014
앤픽몰 사기 쇼핑몰 팀미션 주의 안내 사칭 ,https://blog.naver.com/dtive84494/224041107980, 사칭 팀미션사기 주식사기 코인사기 스캠사기 사칭사기 공모주사기 투자사기 투자사기대응법 투자사기법적대응 사기피해회복 사기피해대응 사기피해전문변호사 핀테크전문 사기피해전문 ,데이 강민성 변호사,blog.naver.com/dtive84494,20251014
VKS파트너스 사기 투자 리딩방을 가장한 금전갈취 수법 사칭 ,https://blog.naver.com/instlltion64901/224040966436, 사칭 팀미션사기 주식사기 코인사기 스캠사기 사칭사기 공모주사기 투자사기 투자사기대응법 투자사기법적대응 사기피해회복 사기피해대응 사기피해전문변호사 핀테크전문 사기피해전문 ,daylaw 강민성 대표 변호사,blog.naver.com/instlltion64901,20251014
DIM 사기 사칭 자동매매라 믿고 맡긴 돈이 순식간에 사라졌다,https://blog.naver.com/resilient77515/224040921455,사라졌다 팀미션사기 주식사기 코인사기 스캠사기 사칭사기 공모주사기 투자사기 투자사기대응법 투자사기법적대응 사기피해회복 사기피해대응 사기피해전문변호사 핀테크전문 사기피해전문 ,데이 강민성 변호사,blog.naver.com/resilient77515,20251014
국내 최초 비트코인으로 동문회비 받는 대학교 근황,https://blog.naver.com/loonshots88/224041289757, quot 가상자산으로 받은 회비는 어떻게 회계 처리하지 quot 그리고 quot 가격 변동이 심한데 평가 기준은 뭐지 quot 사람들의 이런 걱정에 대해서 총동문회는 핀테크 전문기업인 웨이브릿지의 자문을 받아서 회비의 원화 ,Better Ideas,blog.naver.com/loonshots88,20251014
2025년 10월14일 미국증시 주요이슈 파파존스 아폴로 글로벌 ,https://blog.naver.com/ninimim12/224041275811,투자 관점에서 보면 핀테크 섹터의 수익성 확보가 긍정적 신호예요 이 앱의 성공 사례는 글로벌 파파존스인수 알츠하이머진단 페이페이IPO 나비타스주가 제롬파월연설 핀테크상장 AI반도체 M amp A소식,즐거운 재테크,blog.naver.com/ninimim12,20251014
XAUUSD 사기 금거래 사칭의 실체 주의하셔야 합니다 사칭 ,https://blog.naver.com/discernment30649/224041048638, 사칭 팀미션사기 주식사기 코인사기 스캠사기 사칭사기 공모주사기 투자사기 투자사기대응법 투자사기법적대응 사기피해회복 사기피해대응 사기피해전문변호사 핀테크전문 사기피해전문 ,daylaw 강민성 대표 변호사,blog.naver.com/discernment30649,20251014
씨오비 사기 사칭 COB 코인투자 조심해야합니다,https://blog.naver.com/mgreatmaild18/224041112902,조심해야합니다 팀미션사기 주식사기 코인사기 스캠사기 사칭사기 공모주사기 투자사기 투자사기대응법 투자사기법적대응 사기피해회복 사기피해대응 사기피해전문변호사 핀테크전문 ,daylaw,blog.naver.com/mgreatmaild18,20251014
VKS파트너스 사기 투자 리딩방의 피해 이렇게 대응하자 사칭 ,https://blog.naver.com/convulse87018/224040977087, 사칭 팀미션사기 주식사기 코인사기 스캠사기 사칭사기 공모주사기 투자사기 투자사기대응법 투자사기법적대응 사기피해회복 사기피해대응 사기피해전문변호사 핀테크전문 사기피해전문 ,daylaw 강민성 대표 변호사,blog.naver.com/convulse87018,20251014
코스피 코스닥 주식 장 정리 2025년 10월 14일,https://blog.naver.com/riverminsik/224041270937,종속회사로 다날엔터테인먼트 음악 영상 캐릭터 뉴미디어 콘텐츠 등의 제작 유통 다날핀테크 소프트웨어 개발 다날에프엔비 커피 프랜차이즈 달콤 등을 보유 lt 다날 세계 최대 써클과 빅딜 국내 ,riverminsik님의블로그,blog.naver.com/riverminsik,20251014
작지만 강한 핀테크 기업 코나아이를 주목하라,https://blog.naver.com/ndbjf47/224041268827,오늘은 지역화폐 플랫폼과 디지털 인증 기술을 기반으로 핀테크 시장에서 독자적인 입지를 구축하고 개요 코나아이는 전통적으로 스마트카드 결제 기술을 기반으로 성장한 핀테크 결제 플랫폼 ,다양한 정보를 공유해주는 프로젝트,blog.naver.com/ndbjf47,20251014
2025 10 14 화 시장 정리 삼성전자 호실적에 셀 온 의 ,https://blog.naver.com/woonerhyung/224041261682,디지털자산 핀테크분야 출신의 리더십 체계 구축을 통해 신사업 추진력 제고가 가능할 것 네이버는 단기 실적 모멘텀보다 장기 성장성과 구조적 전환을 반영한 중장기적 주가 상승 흐름을 기대 9 ,"우너형의 놀이터(독서,주식,구경)",blog.naver.com/woonerhyung,20251014
MarketBRIDGE 사기 마켓브릿지 사칭 팀미션부업 피해 주의,https://blog.naver.com/emsculte79299/224039878969,주의 팀미션사기 주식사기 코인사기 스캠사기 사칭사기 공모주사기 투자사기 투자사기대응법 투자사기법적대응 사기피해회복 사기피해대응 사기피해전문변호사 핀테크전문 사기피해전문 ,daylaw 강민성 대표 변호사,blog.naver.com/emsculte79299,20251014
PORTMALL 사기 사칭 로맨스스캠 실체와 피해 대응법,https://blog.naver.com/dgzuxzgby/224041254647,대응법 팀미션사기 주식사기 코인사기 스캠사기 사칭사기 공모주사기 투자사기 투자사기대응법 투자사기법적대응 사기피해회복 사기피해대응 사기피해전문변호사 핀테크전문 사기피해전문 ,데이법률사무소,blog.naver.com/dgzuxzgby,20251014
상한가 갔던 아이윈플러스 주가 급등 왜 ,https://blog.naver.com/englishathome/224041248117,QRNG는 양자의 불확정성을 이용해 완전히 예측 불가능한 난수를 생성하는 기술로 정보 보안 암호통신 핀테크 결제 시스템 등에서 활용될 수 있습니다 즉 기존의 단순한 반도체 업체에서 벗어나 보안과 ,주야비 라이프,blog.naver.com/englishathome,20251014
Bullbit 사기 볼비트 하이퍼AI 투자 이렇게 속입니다 사칭 ,https://blog.naver.com/ntinomy28824/224041206415, 사칭 팀미션사기 주식사기 코인사기 스캠사기 사칭사기 공모주사기 투자사기 투자사기대응법 투자사기법적대응 사기피해회복 사기피해대응 사기피해전문변호사 핀테크전문 사기피해전문 ,데이 강민성 변호사,blog.naver.com/ntinomy28824,20251014
씨오비 사기 사칭 코인투자라 속고 빠져든 끝없는 손실의 늪,https://blog.naver.com/unicellulr54589/224040857047,늪 팀미션사기 주식사기 코인사기 스캠사기 사칭사기 공모주사기 투자사기 투자사기대응법 투자사기법적대응 사기피해회복 사기피해대응 사기피해전문변호사 핀테크전문 사기피해전문 ,데이 강민성 변호사,blog.naver.com/unicellulr54589,20251014
고령일수 법인 아닌 개인사업자 사장님들을 위한 맞춤 대출 ,https://blog.naver.com/mmma_1986/224041246153,온라인 및 핀테크 기업 대출 고령일수 및 온라이 은행이나 핀테크 기업들이 제공하는 개인사업자 전용 상품을 활용하는 방법 간편하면서도 빠른 심사 적정한 수준의 자금 확보가 가능 우리나라에는 ,경제/비즈니스 블로그,blog.naver.com/mmma_1986,20251014
